PT	AU	BA	CA	GP	RI	OI	BE	Z2	TI	X1	Y1	Z1	FT	PN	AE	Z3	SO	S1	SE	BS	VL	IS	SI	MA	BP	EP	AR	DI	D2	EA	SU	PD	PY	AB	X4	Y4	Z4	AK	CT	CY	SP	CL	TC	Z8	ZR	ZA	ZB	ZS	Z9	U1	U2	SN	EI	BN	UT	PM	
J	Guo, Jiandong; Pham, Hai D.; Wu, Yan-Bo; Zhang, Dongju; Wang, Xiaotai				Wu, Yan-Bo/N-3377-2014	guo, jiandong/0000-0002-8217-2548; Wang, Xiaotai/0000-0003-3310-3308			Mechanism of Cobalt-Catalyzed Direct Aminocarbonylation of Unactivated Alkyl Electrophiles: Outer-Sphere Amine Substitution To Form Amide Bond								ACS CATALYSIS				10	2			1520	1527		10.1021/acscatal.9b04736				JAN 17 2020	2020	Experimentalists have recently achieved the first chemoselective aminocarbonylation of unactivated alkyl electrophiles, using the common cobalt reagent Co-2(CO)(8) as a catalyst. Here, we present a detailed density functional theory (DFT) mechanistic study on this remarkable reaction. Induced by the Lewis base morpholine (or MOR, the amine substrate), Co-2(CO)(8) disproportionates to [Co(CO)(3)(MOR)(2)](+) and [Co(CO)(4)](-). The active catalyst [Co(CO)(4)](-) undergoes an S(N)2 reaction with the alkyl tosylate substrate to form an alkylcobalt(I) carbonyl intermediate with an inverted configuration at the alpha-carbon. The alkylcobalt(I) carbonyl complex favors CO migratory insertion over beta-hydride elimination. The resulting acylcobalt(I) carbonyl intermediate, along with the MOR and CO substrates, could introduce several pathways for the amide C-N bond formation. The inner-sphere pathways involving Co(I)-bound MOR are ruled out. The outer-sphere pathway in which MOR attacks the Co(I)-bound acyl leads to the amide product and the regenerated [Co(CO)(4)](-). The S(N)2 process is the rate-determining step with the largest energy span (Delta G* = 22.8 kcal/mol). The side reaction of double CO insertion faces a higher selectivity-determining energy barrier and hence is less favorable. This DFT work provides deep mechanistic insights into the Co-2(CO)(8)-promoted chemoselective aminocarbonylation of unactivated alkyl electrophiles, thereby having implications for organocobalt catalysis and transition-metal-catalyzed amide C-N bond-forming reactions.									5	0	0	0	0	0	5			2155-5435			WOS:000508466700057		
J	Li, Yan-Lin; Li, Wen-Duo; Gu, Zheng-Yang; Chen, Jie; Xia, Ji-Bao				Xia, Ji-Bao/AAK-3168-2020; Xia, Ji-Bao/G-6567-2013	Xia, Ji-Bao/0000-0002-2262-5488; Xia, Ji-Bao/0000-0002-2262-5488			Photoredox Ni-Catalyzed Branch-Selective Reductive Coupling of Aldehydes with 1,3-Dienes								ACS CATALYSIS				10	2			1528	1534		10.1021/acscatal.9b05137				JAN 17 2020	2020	We report here a Ni-catalyzed reductive coupling of aldehydes with widely available 1,3-dienes under visible-light photoredox dual catalysis. The homoallyic alcohols are obtained in broad scope with complete branched regioselectivity. Hantzsch ester is used as the hydrogen radical source to oxidize low-valent nickel salt affording Ni-H species. Preliminary mechanistic studies indicate a successive single-electron transfer (SET) pathway and the generation of a key pi-allylnickel intermediate via Ni-H insertion of 1,3-diene in this synergistic catalytic process.									19	1	0	0	3	0	19			2155-5435			WOS:000508466700058		
J	Shadrayan, Vahid; Bukas, Vanessa J.; Gunasooriya, G. T. Kasun Kalhara; Waleson, Jason; Drewery, Matthew; Karibika, Joel; Jones, Jamie; Kennedy, Eric; Adesina, Adesoji; Norskov, Jens K.; Stockenhuber, Michael				Adesina, Adesoji/AAH-7188-2020; STOCKENHUBER, MICHAEL/G-7997-2013; Norskov, Jens K/D-2539-2017; Gunasooriya, G. T. Kasun Kalhara/C-3887-2017; Shadravan, Vahid/AAB-3116-2020; Bukas, Vanessa Jane/C-5044-2019	STOCKENHUBER, MICHAEL/0000-0001-5026-2218; Norskov, Jens K/0000-0002-4427-7728; Gunasooriya, G. T. Kasun Kalhara/0000-0003-1258-7841; Drewery, Matthew/0000-0003-0188-1877; , Eric/0000-0001-7681-5220; Shadravan, Vahid/0000-0002-7392-4998; Bukas, Vanessa Jane/0000-0002-0105-863X			Effect of Manganese on the Selective Catalytic Hydrogenation of COx in the Presence of Light Hydrocarbons Over Ni/Al2O3: An Experimental and Computational Study								ACS CATALYSIS				10	2			1535	1547		10.1021/acscatal.9b04863				JAN 17 2020	2020	The promoting effect of manganese on the Ni/Al2O3 catalyst for the hydrogenation of carbon oxides, in the presence of light hydrocarbons, was studied. Ni/Al2O3 displayed a high activity for the complete conversion of CO and CO2 to methane and C2+ hydrocarbons. Moreover, over a discrete and relatively narrow temperature range, the net concentration of light C2+ hydrocarbons was elevated, with the exit stream containing a higher concentration of C2+ species than was present in the feed stream and the product stream being virtually free of carbon oxides. It is found that the addition of manganese can enhance the selectivity toward the production of light hydrocarbons. A series of Ni-Mn/Al2O3 catalysts, prepared with different Ni/Mn ratios, were studied. Various characterization techniques such as X-ray diffraction (XRD) analysis, CO and H-2 chemisorption, in situ nitric oxide adsorption Fourier transform infrared spectroscopy (NO-FTIR), and temperature-programmed reduction (TPR) were performed to gain an insight into how the addition of Mn to the primary catalyst enhances the yield of light hydrocarbons. The origin of Mn promotion was demonstrated through density functional theory (DFT) calculations, which revealed the favorable Mn substitution at the Ni(211) step edge sites under reducing conditions. The affinity of these Mn species toward oxidation stabilizes the CO dissociation product and thus provides a thermodynamic driving force that promotes C-O bond cleavage compared to the Mn-unmodified catalyst surface.									3	0	0	0	0	0	3			2155-5435			WOS:000508466700059		
J	Zhu, Ran; Chatzidimitriou, Anargyros; Liu, Bowei; Kerwood, Deborah J.; Bond, Jesse Q.				Zhu, Ran/AAO-6811-2020				Understanding the Origin of Maleic Anhydride Selectivity during the Oxidative Scission of Levulinic Acid								ACS CATALYSIS				10	2			1555	1565		10.1021/acscatal.9b04289				JAN 17 2020	2020	Biomass-derived levulinic acid (LA) is a green platform chemical, and we have previously reported an oxidative scission pathway that selectively transforms it into maleic anhydride (MA). This reaction is curious because it requires oxidative scission of the terminal (methyl) carbon in levulinic acid, whereas gas-phase methyl ketone oxidations are typically selective toward internal (alkyl) bond scission. In order to probe the origin of this disparity, we consider trends observed during the oxidative scission of ketones, keto acids, and keto acid analogues, and we highlight influences of steric hindrances, a-carbon substitution, and the presence of a secondary carboxylic acid functionality. We further consider the role of cyclic intermediates, namely Angelica lactones, in mediating selectivity during the oxidative scission of levulinic acid. Our kinetic analysis is supported by FTIR spectroscopy, which reveals the formation of hydrogen-deficient surface intermediates prior to the onset of oxidative scission. Finally, we pair short-contact-time selectivity analysis with GCMS and NMR spectroscopy to identify a previously undisclosed reaction intermediate-protoanemonin-that forms during the oxidative scission of levulinic acid and a-Angelica lactone. We conclude that facile oxidative dehydrogenation of beta-Angelica lactone to form protoanemonin is the major driving force for the high selectivity toward methyl scission during levulinic acid oxidation. We also note that protoanemonin is an intriguing polyfunctional molecule that appears well-suited to bio-based production, and we have observed that it can be synthesized in yields from 55% to 75% (albeit at low concentration presently) during periods of transient reactor operation.									6	0	0	0	0	0	6			2155-5435			WOS:000508466700061		
J	Yalcin, Ozgen; Erwin, Julie E. Molinari; Gerceker, Duygu; Onal, Isik; Wachs, Israel E.				ONAL, ISIK/AAL-1024-2020; Gerceker, Duygu/G-2052-2018	Yalcin, Ozgen/0000-0003-2580-0832; Gerceker, Duygu/0000-0002-6728-0970; Wachs, Israel/0000-0001-5282-128X			Role of Local Structure on Catalytic Reactivity: Comparison of Methanol Oxidation by Aqueous Bioinorganic Enzyme Mimic (Vanadium Haloperoxidase) and Vanadia-Based Heterogeneous Catalyst (Supported VO4/SiO2)								ACS CATALYSIS				10	2			1566	1574		10.1021/acscatal.9b02450				JAN 17 2020	2020	Although enzymes perform redox reactions at milder reaction conditions than heterogeneous solid catalysts, the origin of this reactivity difference still needs to be resolved. In the present study, the mechanisms and kinetics of methanol oxidation by the aqueous bioinorganic vanadium haloperoxidase (VHPO) enzyme mimic and the heterogeneous solid oxide supported VO4/SiO2 catalyst operating in the gas-solid reaction are compared in order to address the origin of the different reactivities. The molecular level chemical transformations during methanol oxidation by the aqueous VHPO enzyme mimic, possessing the oxo-peroxo O=VO2(-O-C) functionalities, and heterogeneous supported VO4/SiO2 catalysts, containing isolated vanadyl O=V(-O-Si)(3) sites, were monitored with time-resolved in situ vibrational spectroscopy (Raman and IR). Both catalytic reactions proceed via the same methoxy (V-OCH3) reaction intermediate formed upon methanol chemisorption at the bridging V-O-C/V-O-Si bonds. The difference in reactivity is related to the much lower activation energy for breaking the C-H bond of the V-OCH3 intermediate, the rate-determining step, by the highly reactive vanadium peroxo VO2 sites only present for bioinorganic enzyme mimics and absent from heterogeneous catalysts under reaction conditions.									2	0	0	0	1	0	2			2155-5435			WOS:000508466700062		
J	Han, Shanlei; Zhao, Yun; Otroshchenko, Tatiana; Zhang, Yaoyuan; Zhao, Dan; Lund, Henrik; Thanh Huyen Vuong; Rabeah, Jabor; Bentrup, Ursula; Kondratenko, Vita A.; Rodemerck, Uwe; Linke, David; Gao, Manglai; Jiao, Haijun; Jiang, Guiyuan; Kondratenko, Evgenii V.					Lund, Henrik/0000-0001-7747-2178; /0000-0002-8301-7654; Gao, Manglai/0000-0002-3397-4317; Rabeah, Jabor/0000-0003-2162-0981; Vuong, Thanh Huyen/0000-0001-5535-7064			Unraveling the Origins of the Synergy Effect between ZrO2 and CrOx in Supported CrZrOx for Propene Formation in Nonoxidative Propane Dehydrogenation								ACS CATALYSIS				10	2			1575	1590		10.1021/acscatal.9b05063				JAN 17 2020	2020	In this work, steady-state tests of propane dehydrogenation, density functional theory calculations, operando UV-vis spectroscopy, ex situ and in situ electron paramagnetic resonance spectroscopy, IR spectroscopy, and temperature-programmed techniques were combined to provide fundamentals for tuning activity and onstream stability of low-loaded catalysts with supported CrZrOx species. Two neighboring Zr-cus (cus = coordinatively unsaturated) sites were concluded to be mainly responsible for propane dehydrogenation to propene. They are formed upon reductive catalyst treatment, and their concentration depends on the strength of interaction among CrOx, ZrO2, and support and on the size of ZrO2 crystallites in CrZrOx. SiO2 weakly interacting with CrOx was found to be a more preferable support than Al2O3- or TiO2-based supports. CrOx species promotes formation of Zr-cus sites and improves their intrinsic activity for the desired reaction. CrOx also contributes to coke formation as concluded from operando UV-vis analysis. Cr20Zr80/SiO2 possessing about 3.9 or 2.5 times lower amounts of chromium or zirconium in comparison with an analogue of industrial K-CrOx/Al2O3 or state-of-the-art Ru/LaZrOx revealed about 2 times higher space-time yield of propene at 30% propane conversion at 550 degrees C. Moreover, this catalyst was durable over 50 dehydrogenation/regeneration cycles lasting 150 h.									19	0	0	0	2	0	19			2155-5435			WOS:000508466700063		
J	Sian, Leonardo; Macchioni, Alceo; Zuccaccia, Cristiano				Zuccaccia, Cristiano/M-7080-2014; Macchioni, Alceo/F-1234-2014	Zuccaccia, Cristiano/0000-0002-9835-2818; Macchioni, Alceo/0000-0001-7866-8332			Understanding the Role of Metallocenium Ion-Pair Aggregates on the Rate of Olefin Insertion into the Metal-Carbon Bond								ACS CATALYSIS				10	2			1591	1606		10.1021/acscatal.9b04929				JAN 17 2020	2020	An integrated thermodynamic and kinetic study was carried out to clarify how the formation of ionic aggregates higher than ion pairs affects the rate of olefin insertion into the Zr-C bond. To this aim, the reaction with olefin of three-member zirconaziridium metallacycles [Cp2Zr-(eta(2)-CH2-N(R)(2))](+)[X](-) [R = C18H37; X- = MeB(C6F5)(3)(-) (1BN) or B(C6F5)(4)(-) (1BT)], models for tight (t-ISIP, 1BN) and loose (l-ISIP, 1BT) inner sphere ion pair (ISIPs), was studied at different levels of concentration and thus self-aggregation. Both 1BN and 1BT undergo a regioselective insertion of a single a-olefin molecule (1-hexene or 2-Me-1-heptene) into the Zr-C bond to form the corresponding five-member metallacycles outer sphere ion pairs (2BN, 2BT, 3BN, and 3BT), with no evidence for further olefin insertions. Under comparable experimental conditions, where monomeric ion pairs dominate (aggregation number N approximate to 1), the apparent rate constant (k(app)) of 1-hexene insertion into 1BT is about 200 times higher than that in 1BN, in agreement with the weaker strength of cation-anion interaction in the former. For 1BT, k(app) is only marginally affected by the self-aggregation level in all investigated experimental conditions. For example, k(app) = 1.1 M-1 s(-1) (N approximate to 1.1) and 1.3 (N approximate to 4.8) for the insertion reaction of 1-hexene in toluene at 223 K and range from 19 x 10(-3) M-1 s(-1) (N approximate to 1.5) to 10 x 10(-3) (N approximate to 39) for the insertion of 2-Me-1-heptene in methylcyclohexane at 258 K. On the contrary, k(app) is markedly dependent on self-aggregation in the case of 1BN. For instance, when 1BN is reacted with 1-hexene in methylcyclohexane at 258 K, k(app) increases more than 1 order of magnitude, from 6 x 10(-3) to 93 x 10(-3) M-1 s(-1), upon increasing the aggregation level from N approximate to 1 ([1BN] = 6 x 10(-3) M) to N approximate to 4.6 ([1BN] = 12.8 x 10(-3) M). Although the insertion of 1-hexene in 1BN is faster in the slightly more polar solvent toluene (k(app) = 39 x 10(-5) M, N approximate to 1), the relative reactivity difference between ion pairs and larger ionic aggregates is similar in both solvents (about 4X and 3X increment, on passing from N 1.0 to N 1.6, in methylcyclohexane and toluene, respectively). The addition of an inert external salt with a common counterion (2BN) to solution of 1BN dramatically raises the olefin insertion rate constant: at [1BN] = 6 x 10(-5) M, k(app) increases from 6 x 10(-3) M-(1) s(-1), in the absence of 2BN, to 42 x 10(-3), 90 x 10(-3), and 166 x 10(-3) M-1 s(-1) in the presence of 1, 3, and 5 equiv of 2BN, respectively. All of the thermodynamic and kinetic data can be rationalized by taking into account the strength of cation-anion interaction in the two kinds of ion pairs. In t-ISIPs, the cation-anion interaction energy is relatively strong, resulting in a relatively small dipole moment and a little thermodynamic tendency to self-aggregate. However, under conditions where homo (or mixed) ion aggregates form, an additional weakening of the cation-anion interaction occurs, causing a substantial increase of the intrinsic reactivity of each t-ISIP within aggregates.On the other side, the cation-anion interaction is already relatively weak in t-ISIPs and ionic aggregates forms much more easily from the thermodynamic point of view; in this case, however, the extra weakening of cation-anion interaction only marginally alters the overall barrier for olefin insertion in each t-ISIP.									8	0	0	0	0	0	8			2155-5435			WOS:000508466700064		
J	Alvarenga, Natalia; Payer, Stefan E.; Petermeier, Philipp; Kohlfuerst, Christoph; Meleiro Porto, Andre Luiz; Schrittwieser, Joerg H.; Kroutil, Wolfgang				Schrittwieser, Joerg/I-1011-2019	Schrittwieser, Joerg/0000-0002-5780-3221; Petermeier, Philipp/0000-0002-5007-9808; Kroutil, Wolfgang/0000-0002-2151-6394			Asymmetric Synthesis of Dihydropinidine Enabled by Concurrent Multienzyme Catalysis and a Biocatalytic Alternative to Krapcho Dealkoxycarbonylation								ACS CATALYSIS				10	2			1607	1620		10.1021/acscatal.9b04611				JAN 17 2020	2020	Dihydropinidine is a piperidine alkaloid found in spruce needles that has shown promising antifeedant activity against the large pine weevil, a widespread and economically relevant pest of coniferous tree plantations. Chemo-enzymatic approaches have previously been shown to enable a step economic access to both enantiomers of this alkaloid, but the scalability of these syntheses is limited. Herein, we report a chemo-enzymatic route to dihydropinidine that is dominated by biocatalytic steps and affords the target alkaloid in excellent stereoisomeric purity (>99% ee and de) and high yield (57% overall) on multigram scale. Our synthesis makes use of a solvent-free, Lewis acid-catalyzed Michael addition and a biocatalytic alternative to Krapcho dealkoxycarbonylation, achieved by pig liver esterase (PLE)-catalyzed ester hydrolysis and acidification, and specifically developed for this purpose, to access a key intermediate, nonane-2,6-dione. This diketone is then converted into dihydropinidine by a concurrent one-pot (cascade) biotransformation catalyzed by a transaminase, an imine reductase, and an alcohol dehydrogenase. High yields and excellent regio- and stereoselectivities of the individual transformations render chromatographic purification of intermediates unnecessary and make it possible to carry out the entire sequence with a final hydrochloride precipitation of the target alkaloid as the sole purification step.									5	0	0	0	1	0	5			2155-5435			WOS:000508466700065		
J	Schwarz, J. Luca; Huang, Huan-Ming; Paulisch, Tiffany O.; Glorius, Frank				Huang, Huan-Ming/AAB-1528-2019; Glorius, Frank/K-6385-2015	Huang, Huan-Ming/0000-0001-9461-6508; Glorius, Frank/0000-0002-0648-956X			Dialkylation of 1,3-Dienes by Dual Photoredox and Chromium Catalysis								ACS CATALYSIS				10	2			1621	1627		10.1021/acscatal.9b04222				JAN 17 2020	2020	The direct conversion of feedstock chemicals into value-added products is of broad interest in chemical research. Herein, we present a regioselective and diastereoselective three-component dialkylation of feedstock 1,3-dienes with Hantzsch esters and aldehydes for the synthesis of homoallylic alcohols. The reaction is enabled by dual photoredox and chromium catalysis and can also be performed enantioselectively by employing chromium-bisoxazoline complexes.									35	0	0	0	7	0	35			2155-5435			WOS:000508466700066		
J	Zhang, Peng-Fang; Zhang, Jun-Yu; Sheng, Tian; Lu, Yan-Qiu; Yin, Zu-Wei; Li, Yu-Yang; Peng, Xin-Xing; Zhou, Yao; Li, Jun-Tao; Wu, Yi-Jin; Lin, Jin-Xia; Xu, Bin-Bin; Qu, Xi-Ming; Huang, Ling; Sun, Shi-Gang				周, 周尧/AAJ-8158-2020; Peng, Xinxing/U-4102-2019; Sheng, Tian/G-1120-2017	Sheng, Tian/0000-0001-5711-3012; zhou, yao/0000-0003-4021-6597; Yin, Zuwei/0000-0002-0728-1154			Synergetic Effect of Ru and NiO in the Electrocatalytic Decomposition of Li2CO3 to Enhance the Performance of a Li-CO2/O-2 Battery								ACS CATALYSIS				10	2			1640	1651		10.1021/acscatal.9b04138				JAN 17 2020	2020	Li2CO3 is the cathodic discharge product of a LiCO2/O-2 battery and is difficult to electrochemically decompose. The accumulation of Li2CO3 leads to battery degradation and results in a short lifespan. Herein, a carbon nanotube supported Ru/NiO@Ni catalyst (Ru/NiO@Ni/CNT) is synthesized with Ru nanoparticles (similar to 2.5 nm) anchored on the surface of core-shell structure NiO@Ni nanoparticles (similar to 17 nm). We found strong interfacial interactions between Ru nanoparticles and NiO. XRD and XPS analysis revealed that the presence of Ru could protect the Ni species from being deeply oxidized while the NiO species could modify the local electronic structure of Ru, inducing a higher oxidation state. When such a Ru/NiO@Ni/CNT catalyst is used as a cathode in Li-(CO2/O-2 (v:v = 4:1) batteries, a long cycling life of 105 cycles at a cutoff capacity of 1000 mAh g(-1) with an overpotential as low as 1.01 V was achieved, which is significantly better than 75 and 44 cycles with Ru/CNT and NiO@Ni/CNT catalysts, respectively, and confirms the strong synergetic effect between the Ru and NiO species in the electrocatalytic decomposition of Li2CO3. Density functional theory (DFT) calculations of the electrochemical decomposition of Li2CO3 with the assistance of RuO2 indicates that the formation of O-2 is the rate-determining step. In addition, the formation and decomposition process of Li2CO3 was illuminated at a molecular level by in situ FTIR spectroscopy with Ru/NiO@Ni/CNT catalysts.									18	0	0	0	0	0	18			2155-5435			WOS:000508466700068		
J	Song, Heng; Yang, Zhuoyi; Tung, Chen-Ho; Wang, Wenguang					Song, Heng/0000-0002-2340-1208; Wang, Wenguang/0000-0002-4108-7865			Iron-Catalyzed Reductive Coupling of Nitroarenes with Olefins: Intermediate of Iron-Nitroso Complex								ACS CATALYSIS				10	1			276	281		10.1021/acscatal.9b03604				JAN 3 2020	2020	Using a single half-sandwich iron(II) compound, Cp*Fe(1,2-Ph2PC6H4S)(NCMe) (Cp*(-) = C5Me5-, 1) as a catalyst, reductive coupling of nitroarenes with olefins has been achieved by a well-defined iron(II)/(EtO)(3)SiH system. Through either inter- or intramolecular reductive coupling, various branched amines and indole derivatives have been directly synthesized in one-pot. Mechanistic studies showed that the catalysis is initiated by activation of nitroarenes by the iron(II) catalyst with silane, generating iron-nitrosoarene intermediate for the C-N bond coupling.									21	0	0	0	2	0	21			2155-5435			WOS:000506725100032		
J	Tay, Dillon W. P.; Nobbs, James D.; Romain, Charles; White, Andrew J. P.; Aitipamula, Srinivasulu; van Meurs, Martin; Britovsek, George J. P.				ROMAIN, Charles/L-3807-2019; Nobbs, James D./A-9762-2012; AITIPAMULA, SRINIVASULU/A-4248-2012; Britovsek, George/J-8014-2016; van Meurs, Martin/F-2805-2010	ROMAIN, Charles/0000-0002-1851-8612; Nobbs, James D./0000-0002-4237-2772; AITIPAMULA, SRINIVASULU/0000-0001-7640-9513; Britovsek, George/0000-0001-9321-4814; van Meurs, Martin/0000-0002-8816-3458; Tay Wei Peng, Dillon/0000-0002-4831-5525			gem-Dialkyl Effect in Diphosphine Ligands: Synthesis, Coordination Behavior, and Application in Pd-Catalyzed Hydroformylation								ACS CATALYSIS				10	1			663	671		10.1021/acscatal.9b03007				JAN 3 2020	2020	A series of palladium complexes with C-3-bridged bidentate bis(diphenylphosphino)propane ligands with substituents of varying steric bulk at the central carbon have been synthesized. The size of the gem-dialkyl substituents affects the C-C-C bond angles within the ligands and consequently the P-M-P ligand bite angles. A combination of solid-state X-ray diffraction (XRD) and density functional theory (DFT) studies has shown that an increase in substituent size results in a distortion of the 6-membered metal-ligand chair conformation toward a boat conformation, to avoid bond angle strain. The influence of the gem-dialkyl effect on the catalytic performance of the complexes in palladium-catalyzed hydroformylation of 1-octene has been investigated. While hydroformylation activity to nonanal decreases with increasing size of the gem-dialkyl substituents, a change in chemoselectivity toward nonanol via reductive hydroformylation is observed.									4	0	0	0	1	0	4			2155-5435			WOS:000506725100071		
J	Zhang, Zhikun; Hu, Xile				Zhang, Zhikun/AAQ-5210-2020; hu, xile/A-7687-2010	Zhang, Zhikun/0000-0002-0591-3680; hu, xile/0000-0001-8335-1196			Arylsilylation of Electron-Deficient Alkenes via Cooperative Photoredox and Nickel Catalysis								ACS CATALYSIS				10	1			777	782		10.1021/acscatal.9b04916				JAN 3 2020	2020	Carbosilylation of alkenes can be an efficient approach to the synthesis of organosilicon compounds. However, few general methods of carbosilylation are known. Here, we introduce a strategy for arylsilylation of electron deficient terminal alkenes by combining photoredox-catalyzed silyl radical generation, innate reactivity of silyl radical with alkene, and Ni-catalyzed aryl-alkyl cross-coupling. This cooperative photoredox and nickel catalysis operates under mild conditions. It employs readily available alkenes, aryl bromides, and silane as reagents, and it produces useful synthetic building blocks in a modular manner.									20	1	0	0	7	0	20			2155-5435			WOS:000506725100084		
