PT	AU	BA	CA	GP	RI	OI	BE	Z2	TI	X1	Y1	Z1	FT	PN	AE	Z3	SO	S1	SE	BS	VL	IS	SI	MA	BP	EP	AR	DI	D2	EA	SU	PD	PY	AB	X4	Y4	Z4	AK	CT	CY	SP	CL	TC	Z8	ZR	ZA	ZB	ZS	Z9	U1	U2	SN	EI	BN	UT	PM	
J	Martinez-Martinez, Antonio J.; Royle, Cameron G.; Furfari, Samantha K.; Suriye, Kongkiat; Weller, Andrew S.				Martinez-Martinez, Antonio J/T-3110-2017; Weller, Andrew/C-3004-2009	Martinez-Martinez, Antonio J/0000-0002-0684-1244; Weller, Andrew/0000-0003-1646-8081; Furfari, Samantha/0000-0001-6131-0529; Royle, Cameron/0000-0002-4326-7915			Solid-State Molecular Organometallic Catalysis in Gas/Solid Flow (Flow-SMOM) as Demonstrated by Efficient Room Temperature and Pressure 1-Butene Isomerization								ACS CATALYSIS				10	3			1984	1992		10.1021/acscatal.9b03727				FEB 7 2020	2020	The use of solid-state molecular organometallic chemistry (SMOM-chem) to promote the efficient double bond isomerization of 1-butene to 2-butenes under flow-reactor conditions is reported. Single crystalline catalysts based upon the o--alkane complexes [Rh(R2PCH2CH2PR2)(eta(2)eta(2)-NBA)][BAr4F] (R = Cy, Bu-t; NBA = norbornane; Ar-F = 3,S-(CF3)(2)C6H3) are prepared by hydrogenation of a norbornadiene precursor. For the Bu-t-substituted system this results in the loss of long-range order, which can be re-established by addition of 1-butene to the material to form a mixture of [Rh((Bu2PCH2CH2PBu2)-Bu-t-Bu-t)(cis-2-butene)][BAr4F] and [RE((Bu2PCH2CH2PBu2)-Bu-t-Bu-t)(1-butene)][BAr4F], in an order/disorder/order phase change. Deployment under flow-reactor conditions results in very different on-stream stabilities. With R = Cy rapid deactivation (3 h) to the butadiene complex occurs, [Rh(Cy2PCH2CH2PCy2)(butadiene)][BAr4F], which can be reactivated by simple addition of H-2. While the equivalent butadiene complex does not form with R = Bu-t at 298 K and on-stream conversion is retained up to 90 h, deactivation is suggested to occur via loss of crystallinity of the SMOM catalyst. Both systems operate under the industrially relevant conditions of an isobutene co-feed. cis:trans selectivites for 2-butene are biased in favor of cis for the tBu system and are more leveled for Cy.									5	0	0	0	1	0	5			2155-5435			WOS:000513099200034	32296595	
J	Wang, Dong; Wang, Chuanming; Yang, Weimin				Wang, Dong/N-1365-2018	Wang, Dong/0000-0001-5561-6425; Wang, Chuan-Ming/0000-0003-4019-405X			Three-Dimensional Kinetic Trends in Zeolites Catalyzed Benzene Ethylation Reaction: A Descriptor-Based DFT Study Coupled with Microkinetic Modeling								ACS CATALYSIS				10	3			1652	1662		10.1021/acscatal.9b04556				FEB 7 2020	2020	In zeolite catalysis, both the Bronsted acidity (e.g., acid strength) and reaction conditions (e.g., temperature) have significant influence on catalytic performance. Because of the intimate coupling between acidity-relevant enthalpies and temperature-relevant entropies, it has been challenging to locate the optimal reactivity zone for a given reaction. Here, periodic DFT calculations combined with microkinetic modeling were employed to investigate the effect of both acid strength and reaction temperature simultaneously on benzene ethylation reaction in MFI-structured zeolites involving both the concerted and stepwise pathways. The acid strength using the adsorption energy of ammonia as a descriptor was tailored by two strategies of the isomorphic substitution of heteroatoms and the introduction of extra-framework cations. Good scaling relations were established between the enthalpies of involved transition states and intermediates and the descriptor of acid strength. We pioneered the revelation a three-dimensional activity plot varying with the acid strength and reaction temperature. Three regions with diverse kinetic trends and two boundaries signifying the maximum activity were theoretically demonstrated in benzene ethylation. Subsequent kinetic analyses rationalized these intriguing properties and indicated that the rate-limiting step actually changes with the acid strength. The results hold broad implications for understanding Bronsted acid catalyzed reactions and developing robust catalysts in the future.									4	0	0	0	1	0	4			2155-5435			WOS:000513099200001		
J	Chew, Alex K.; Walker, Theodore W.; Shen, Zhizhang; Demir, Benginur; Witteman, Liam; Euclide, Jack; Huber, George W.; Dumesic, James A.; Van Lehn, Reid C.					Huber, George/0000-0002-7838-6893; DEMIR, Benginur/0000-0003-3469-906X			Effect of Mixed-Solvent Environments on the Selectivity of Acid-Catalyzed Dehydration Reactions								ACS CATALYSIS				10	3			1679	1691		10.1021/acscatal.9b03460				FEB 7 2020	2020	The composition of the liquid phase can alter the rates of individual reaction steps and thus alter the selectivity of acid-catalyzed reactions, but these solvent effects are difficult to anticipate for design purposes. Herein, we report the kinetics and selectivity of Bronsted acid-catalyzed 1,2-propanediol dehydration in pure water and in aqueous mixtures of the polar aprotic cosolvents gamma-valerolactone, 1,4-dioxane, tetrahydrofuran, N-methyl-2-pyrrolidone, tetramethylene sulfoxide, and dimethyl sulfoxide at 433 K. We find that the major product of 1,2-propanediol dehydration is propanal in most mixed-solvent environments with selectivities between 1 and 68 mol %. In contrast, 1,2-propanediol dehydration in aqueous mixtures of dimethyl sulfoxide affords acetone as the major product with up to 48% selectivity with minimal propanal formation. We use classical molecular dynamics simulations to probe these solvent effects by computing the difference between the solvation free energies of 1,2-propanediol and propanal in aqueous mixtures of polar aprotic cosolvents and in pure water. We find that the difference in the solvation free energies is correlated with the rates of propanal formation in all mixed-solvent environments, indicating that the solvent-mediated stabilization of the product state relative to the reactant state translates to increased selectivity toward the same product. Similar agreement between simulated solvation free energies and experimental reaction rates/selectivities is established for the acid-catalyzed dehydration of cis- and trans-1,2-cyclohexanediol and 1,3-cyclohexanediol. Finally, analysis of the solvation environment around 1,2-propanediol shows that dimethyl sulfoxide uniquely competes against water to solvate reactive hydroxyl groups, which causes a change in reaction mechanism in this solvent system that leads to the formation of acetone rather than propanal. These results represent a step toward the computationally efficient screening of solvent systems for acid-catalyzed, liquid-phase processes.									13	1	0	0	1	0	14			2155-5435			WOS:000513099200003		
J	Phillips, Robert S.; Craig, Steven; Kovalevsky, Andrey; Gerlits, Oksana; Weiss, Kevin; Iorgu, Andreea I.; Heyes, Derren J.; Hay, Sam				Hay, Sam/D-5974-2012	Hay, Sam/0000-0003-3274-0938; Iorgu, Andreea/0000-0002-1363-3697; Heyes, Derren/0000-0002-7453-1571; Kovalevsky, Andrey/0000-0003-4459-9142			Pressure and Temperature Effects on the Formation of Aminoacrylate Intermediates of Tyrosine Phenol-lyase Demonstrate Reaction Dynamics								ACS CATALYSIS				10	3			1692	1703		10.1021/acscatal.9b03967				FEB 7 2020	2020	The structures of aminoacrylate intermediates of wild-type, F448A mutant, and perdeuterated tyrosine phenol-lyase (TPL) formed from L-tyrosine, 3-F-L-tyrosine, S-ethyl-L-cysteine, and L-serine, with bound 4-hydroxypyridine, were determined by X-ray crystallography. All the aminoacrylate Schiffs base structures in chain A are identical regardless of the substrate used to form them. 4-Hydroxypyridine is also in an identical location, except for F448A TPL, where it is displaced about 1 angstrom due to the increased size of the active site. In chain B, we have found different complexes depending on the substrate. With wild-type TPL, L-tyrosine gave no density, 3-F-L-tyrosine gave a gem-diamine, and L-serine gave a gem-diamine in chain B. S-Ethyl-L-cysteine formed an aminoacrylate in chain B with both wild-type and F448A TPL, but perdeuterated TPL with S-ethyl-L-cysteine formed a gem-diamine of aminoacrylate. The kinetics of aminoacrylate intermediate formation from L-tyrosine and S-ethyl-L-cysteine were followed by stopped-flow spectrophotometry at temperatures from 281 to 320 K and hydrostatic pressures ranging from 1 bar to 1.5 kbar at 293 K. There are large negative values of Delta S+, Delta C-p+, Delta V+, and Delta beta+ for aminoacrylate intermediate formation for L-tyrosine but not for S-ethyl-L-cysteine. Formation of the aminoacrylate intermediates from L-tyrosine and S-ethyl-L-cysteine shows heavy enzyme deuterium kinetic isotope effects with perdeuterated TPL that are strongly temperature- and pressure-dependent and may be normal or inverse depending on conditions. These results suggest that conformational dynamics as well as vibrational coupling play a key role in the mechanism of the elimination reaction of L-tyrosine catalyzed by TPL.									2	0	0	0	0	0	2			2155-5435			WOS:000513099200004		
J	Kumawat, Jugal; Gupta, Virendra Kumar				Gupta, Virendrakumar/AAB-6766-2021	Kumawat, Jugal/0000-0002-7190-8572			Single to Multiple Site Behavior of Metallocenes through C-H Activation for Olefin Polymerization: A Mechanistic Insight from DFT								ACS CATALYSIS				10	3			1704	1715		10.1021/acscatal.9b03741				FEB 7 2020	2020	Density functional theory has been used to study single to multiple site behavior of metallocene catalysts for olefin polymerization using (Cp-Pr)(2)Hf(R)(2) and (Cp-Pr)(2)Zr(R)(2) (here, R = Me and n-butyl group) and boron activators B(C6F5)(3) and [CPh3](+)[B(C6F5)(4)](-). Detailed pathways were investigated for two steps: (i) catalyst activation and (ii) ethylene and 1-hexene polymerization. For the catalyst activation step, the C-H activation of Cp-substituents (here, the n-propyl group) has also been studied, which leads to another active site named "metal cyclic active site" in comparison to the conventional active site. Among these sites, the formation of a metal cyclic active site is slower with respect to the conventional active site. Additionally, two different routes have been explored for the catalyst activation, depending on the nature of activators, and observed that [CPh3](+)[B(C6F5)(4)](-) is a better activator with respect to B(C6F5)(3). Moreover, complete insertion (primary and secondary) and termination (chain transfer to monomer and beta-H elimination) steps have also been studied for both the active sites. These results suggest that the metal cyclic active site can also produce the ethylene and 1-hexene polymer, which defines the multiple site behavior of metallocene catalysts, which explains the broadening of molecular weight distribution of linear low-density polyethylene-produced metallocene catalysts. Along with hafnocene and zirconocene, the toluene-solvated hafnocene catalyst system has also been investigated for catalyst activation and ethylene polymerization for comparison study. These results indicate that the toluene-solvated hafnocene catalyst system is energetically more facile in comparison to other catalysts. Furthermore, the effect of solvents as well as dispersion interaction on catalyst activation steps has been studied for the (Cp-Pr)(2)M(n-butyl)(2) (M = Hf and Zr) catalyst systems and observed that the dispersion interaction played an important role in the catalyst activation process. In addition to this, the regio- and stereoselective behavior of 1-hexene monomer for the (Cp-Pr)(2)Hf(Me)(2) catalyst has been investigated, and it was found that the metal cyclic active site improves the stereoselective nature of the hafnocene catalyst. Therefore, the current chemical calculations provide insights into the nature of active sites in metallocene catalysts for olefin polymerization.									4	0	0	0	0	0	4			2155-5435			WOS:000513099200005		
J	Wrasman, Cody J.; Riscoe, Andrew R.; Lee, Hyosun; Cargnello, Matteo					Cargnello, Matteo/0000-0002-7344-9031			Dilute Pd/Au Alloys Replace Au/TiO2 Interface for Selective Oxidation Reactions								ACS CATALYSIS				10	3			1716	1720		10.1021/acscatal.9b05227				FEB 7 2020	2020	The tandem nature of selective alcohol oxidation with in situ-generated oxidants over Au/metal oxide catalysts is demonstrated. Colloidal synthesis is used to show that while Au nanoparticles require an oxide interface to generate the selective oxidant from a mixture of hydrogen and oxygen, dilute Pd/Au alloy nanoparticles are able to generate oxidants even when immobilized on inert carbon supports because of the hydrogen dissociation ability of Pd single atoms in Au. These oxidants may travel through the gas phase to be utilized by a variety of metal oxides to selectively oxidize primary and secondary alcohols to their respective carbonyls.									5	0	0	0	0	0	5			2155-5435			WOS:000513099200006		
J	Mutschler, Robin; Moioli, Emanuele; Zhao, Kun; Lombardo, Loris; Oveisi, Emad; Porta, Alessandro; Falbo, Leonardo; Visconti, Carlo Giorgio; Lietti, Luca; Zuttel, Andreas				Moioli, Emanuele/ABB-3183-2020; Visconti, Carlo Giorgio/G-6881-2013	Moioli, Emanuele/0000-0002-2943-6823; Lietti, Luca/0000-0002-2888-9708; Visconti, Carlo Giorgio/0000-0001-5205-982X; Lombardo, Loris/0000-0003-2968-6686; Mutschler, Robin/0000-0001-9633-8054; zhao, kun/0000-0002-7182-8089			Imaging Catalysis: Operando Investigation of the CO2 Hydrogenation Reaction Dynamics by Means of Infrared Thermography								ACS CATALYSIS				10	3			1721	1730		10.1021/acscatal.9b04475				FEB 7 2020	2020	Infrared thermography is a powerful tool to investigate the dynamic evolution of temperature in chemical reactions. The CO2 hydrogenation reaction is an ideal model reaction to assess the presented technique due to its high exothermicity. Various dynamic experiments are performed in a newly designed reaction cell with an infrared transmitting ZnSe window. In particular, the gas exchange reactions between CO2 and H-2, the coinjection of the two reactants, and the study of the effect of inert gas addition are investigated. Here, we show that the reaction rate on the surface of a catalyst can be localized in time and space by means of infrared thermography. This opens the way to the precise description of reaction dynamics, in particular for reactions operating in intermitting conditions. Furthermore, we show that the combination of infrared thermography with other analytic techniques such as rapid and quantitative mass spectrometry enables a holistic understanding of the transient reaction phenomena.									7	0	0	0	1	0	7			2155-5435			WOS:000513099200007		
J	Hill, Alexander J.; Seo, Chang Yup; Chen, Xiaoyin; Bhat, Adarsh; Fisher, Galen B.; Levert, Andrej; Schwank, Johannes W.				Bhat, Adarsh/AAR-9601-2021; Schwank, Johannes W/A-8315-2013; Lenert, Andrej/P-8433-2015	Bhat, Adarsh/0000-0002-1142-6731; Schwank, Johannes W/0000-0002-8218-5189; Hill, Alexander/0000-0003-0181-7920; Lenert, Andrej/0000-0002-1142-6627			Thermally Induced Restructuring of Pd@CeO2 and Pd@SiO2 Nanoparticles as a Strategy for Enhancing Low-Temperature Catalytic Activity								ACS CATALYSIS				10	3			1731	1741		10.1021/acscatal.9b05224				FEB 7 2020	2020	Retaining high catalytic activity after exposure to elevated temperatures remains a crucial challenge for applications such as automotive emissions control. While catalysts generally sinter and lose activity after aging at high temperature, here we illustrate that palladium in a core@shell morphology responds very differently. After 800 degrees C aging in oxygen, palladium redisperses into the encapsulating shell. The redispersion is more pronounced, and nearly complete, when palladium is encapsulated by reducible ceria, as opposed to nonreducible silica. This difference is likely due to the availability of lattice oxygen. Through comparisons with polycrystalline ceria nanoparticles, surface decorated with Pd, we show that for favorable restructuring to occur under our simple aging conditions, the process must start from a particular initial configuration, the core@shell. Furthermore, the redispersion of palladium in ceria is accompanied by a change in oxidation state and coordination that inhibits the growth of ceria crystallites in the shell, thereby producing sites that better access the reducibility of the ceria shell support. Together, these effects result in a decrease in the temperature required for 90% conversion (T-90) of carbon monoxide. Our findings demonstrate that thermally induced restructuring of core@shell morphologies under controlled conditions provides a strategy for enhancing low-temperature catalytic activity.									11	0	0	0	1	0	11			2155-5435			WOS:000513099200008		
J	Moon, Patrick J.; Lundgren, Rylan J.					Lundgren, Rylan/0000-0002-7760-6946; Moon, Patrick/0000-0003-0555-1621			Metal-Catalyzed Ionic Decarboxylative Cross-Coupling Reactions of C(sp(3)) Acids: Reaction Development, Mechanisms, and Application								ACS CATALYSIS				10	3			1742	1753		10.1021/acscatal.9b04956				FEB 7 2020	2020	The direct transition-metal-catalyzed conversion of carboxylic acid groups into other C-C or C-X bonds provides a complementary bond disconnection to traditional cross-coupling manifolds. Decarboxylative coupling strategies can be divided into two mechanistic frameworks: decarboxylative homolysis processes that generate radicals and decarboxylative heterolysis processes that generate carbanions. The challenge of both inducing decarboxylation with unmodified substrates and enabling efficient interception by a suitable transition-metal complex has made achieving general approaches to catalytic cross-couplings of carboxylic acids elusive. Thus, more wasteful indirect strategies involving preactivation of the acid unit are more common. This Perspective article highlights recent work in the area of metal-catalyzed ionic decarboxylative cross-coupling reactions of unmodified C(sp(3)) carboxylic acids. In these processes, the carboxylic acid unit serves as a surrogate for nucleophiles normally generated by deprotonation or by the use of organometallic reagents. In many cases, this approach can allow for alkylation reactions under less-basic conditions, improving functional group compatibility, ease of access to starting materials, and inhibit undesirable overfunctionalization of products. Commentary on reaction development, mechanism, and application is provided along with comparisons to related transformations.									27	0	0	0	4	0	27			2155-5435			WOS:000513099200009		
J	Todorova, Tanya K.; Schreiber, Moritz W.; Fontecave, Marc				Todorova, Tanya K./M-1849-2013	Todorova, Tanya K./0000-0002-7731-6498			Mechanistic Understanding of CO2 Reduction Reaction (CO2RR) Toward Multicarbon Products by Heterogeneous Copper-Based Catalysts								ACS CATALYSIS				10	3			1754	1768		10.1021/acscatal.9b04746				FEB 7 2020	2020	In the recent years, significant progress has been made toward designing active and selective catalysts for electrochemical CO2 reduction, with particular interest focused on the two major C2 products-ethylene and ethanol. Numerous efforts have been made to enhance the understanding of the heterogeneous copper-based CO2 reduction mechanisms by computational studies. Here we provide a critical assessment of various proposed scenarios of the initial and post C-C coupling steps that result in either ethylene or ethanol. In silico rationalization of the parameters controlling the product selectivity, such as the catalyst structure and composition (Cu facets, the presence of defective sites and/or subsurface oxygen atoms, or the interplay with a second metal) and the reaction conditions (pH, applied potential, and electrolyte), is provided. A comprehensive scheme combining the proposed pathways is derived, and the issues that are still under debate and require further investigations are highlighted.									71	1	0	0	5	0	72			2155-5435			WOS:000513099200010		
J	Green, Kerry-Ann; Hoover, Jessica M.				Hoover, Jessica/J-7500-2019	Hoover, Jessica/0000-0003-0254-5090			Intermediacy of Copper(I) under Oxidative Conditions in the Aerobic Copper-Catalyzed Decarboxylative Thiolation of Benzoic Acids								ACS CATALYSIS				10	3			1769	1782		10.1021/acscatal.9b04110				FEB 7 2020	2020	An experimental mechanistic study of the aerobic copper-catalyzed decarboxylative thiolation of benzoic acids with arenethiols is reported. For the model reaction, the findings support the corresponding disulfide (PhSSPh) of the arenethiol (PhSH) as the active thiolating source under reaction conditions. Synthesis and reactivity studies along with kinetic measurements support the chemical and kinetic competence of catalytically active well-defined Cu complexes: (phen)Cu-I(O2CC6H4-o-NO2) (2), [(phen)Cu-I(mu-SC6H5)](2) (3), (phen)Cu-I(C6H4-o-NO2) (4), and (phen)Cu-II(O2CC6H4-o-NO2)(2) (5) (phen = 1,10-phenanthroline). The presence of an induction period in the stoichiometric reaction of the copper(II) complex (phen)Cu-II(O2CC6H4-o-NO2)(2) (5) with PhSSPh and the absence of an induction period in the analogous stoichiometric reaction of the copper(I) complex (phen)Cu-I(O2CC6H4-o-NO2) (2) suggest that a copper(I) carboxylate is a more likely intermediate than a copper(II) carboxylate. The observation of in situ reduction of Cu-II to Cu-I further supports Cu-I as the primary active catalytic species, and spectroscopic studies also indicate the catalyst resting state to be a Cu-I species. The catalytic reaction exhibits a first-order dependence on [Cu-I] and [2-nitrobenzoic acid] and a zero-order dependence on [PhSSPh] and p(O-2), suggestive of turnover-limiting decarboxylation of a copper(I) carboxylate. Oxygen was found to promote the essential oxidative cleavage of the copper(I) thiolate intermediate [(phen)Cu-I(mu-SC6H5)](2) (3) to regenerate a catalytically active [(phen)Cu-II] (Cu-ox) species with concomitant formation of PhSSPh. On the basis of these findings, a reaction pathway is proposed for the C-S coupling reaction that includes the key Cu-I-based intermediates (phen)Cu-I(O2CC6H4-o-NO2) (2) and (phen)Cu-I(C6H4-o-NO2) (4). The pathway accounts for the role of O-2 in generating the active thiolating source, PhSSPh, as well as enabling catalytic turnover of in situ generated [(phen)Cu-I(mu-SC6H5)](2) (3).									7	0	0	0	1	0	7			2155-5435			WOS:000513099200011		
J	Tao, Lin; Ren, Yiqi; Li, Chunzhi; Li, He; Chen, Xuelian; Liu, Lina; Yang, Qihua				Li, He/D-2104-2017	Li, He/0000-0003-0830-0844; Li, ChunZhi/0000-0002-7983-204X			Efficient Asymmetric Hydrogenation of Quinolines over Chiral Porous Polymers Integrated with Substrate Activation Sites								ACS CATALYSIS				10	3			1783	1791		10.1021/acscatal.9b04838				FEB 7 2020	2020	Heterogeneous asymmetric hydrogenation of quinolines for the production of optically active tetrahydroquinoline derivatives still remains a difficult task due to the aromatic stability of quinolines. Herein, we reported efficient heterogeneous asymmetric hydrogenation of quinolines over chiral porous polymers integrated with both chiral active sites (VDPEN-RuOTs) and substrate activation sites (TsOH). The porous polymer integrated with TsOH is 10 times more active than that without TsOH in the asymmetric hydrogenation of 2-methylquinoline. The volcano curve of TOF with the TsOH/Ru ratio confirms the synergistic catalysis of VDPEN-RuOTs and TsOH. Comparison results with a homogeneous catalytic system imply that the synergy between chiral centers and acidic sites is greatly enhanced in the polymer network. Under optimized conditions, the chiral porous polymer afforded up to 90% ee with 90 h(-1) TOF, which is one of the best solid catalysts for asymmetric hydrogenation of quinoline derivatives ever reported. Furthermore, the bifunctional porous polymers realized the asymmetric cascade hydrogenation/reductive amination reaction to obtain benzo-quinolizidines. Our primary results suggest that the incorporation of substrate activation sites near chiral centers is an efficient strategy for the synthesis of high-performance solid catalysts for heterogeneous asymmetric catalysis.									8	1	0	0	0	0	8			2155-5435			WOS:000513099200012		
