PT	AU	BA	CA	GP	RI	OI	BE	Z2	TI	X1	Y1	Z1	FT	PN	AE	Z3	SO	S1	SE	BS	VL	IS	SI	MA	BP	EP	AR	DI	D2	EA	SU	PD	PY	AB	X4	Y4	Z4	AK	CT	CY	SP	CL	TC	Z8	ZR	ZA	ZB	ZS	Z9	U1	U2	SN	EI	BN	UT	PM	
J	Hua, Jia; Dong, Xinglong; Wang, Jianjian; Chen, Cailing; Shi, Zhan; Liu, Zhaohui; Han, Yu				han, yu/AAD-5241-2021; Han, Yu/N-2036-2015	Han, Yu/0000-0003-1462-1118; Shi, Zhan/0000-0001-9717-1487; Chen, Cailing/0000-0003-2598-1354; Dong, Xinglong/0000-0001-6478-8819			Methanol-to-Olefin Conversion over Small-Pore DDR Zeolites: Tuning the Propylene Selectivity via the Olefin-Based Catalytic Cycle								ACS CATALYSIS				10	5			3009	3017		10.1021/acscatal.9b05521				MAR 6 2020	2020	Zeolites that have ultrasmall pore sizes usually exhibit high selectivity toward light olefins when used as catalysts for the conversion of methanol to hydrocarbons (MTH). However, tuning the selectivity of a desired product in a controllable manner remains difficult. In this study, we performed MTH reactions on DDR zeolites at 400 degrees C and subcoinplete methanol conversions to investigate how the highly constrained pore structure of a DDR zeolite impacts on the reaction pathways and the product selectivity. We find that the propylene selectivity monotonically increases as the aluminum content and crystallize size of the DDR zeolite decreases. With this understanding, we are able to maximize the propylene selectivity up to 50.6% by modifying the DDR zeolite. We performed isotopic tracing experiments and analysis of residual species in the catalysts to validate the dual-cycle (aromatic- and olefin-based cycle) mechanism in DDR zeolite-catalyzed MTH and demonstrate that propylene is primarily produced from the olefin-based cycle. We attribute the unique behavior of DDR zeolites to that their ultrasmall pore sizes impose restriction on the molecular diffusion of higher olefins, leading to a more important role of the olefin-based catalytic cycle in the reaction, in comparison with other zeolites with larger pores.									4	0	0	0	0	0	4			2155-5435			WOS:000518876300012		
J	Li, Menggang; Zhao, Zhonglong; Xia, Zhonghong; Yang, Yong; Luo, Mingchuan; Huang, Yarong; Sun, Yingjun; Chao, Yuguang; Yang, Wenxiu; Yang, Weiwei; Yu, Yongsheng; Lu, Gang; Guo, Shaojun				Luo, Mingchuan/AAZ-1739-2020				Lavender-Like Ga-Doped Pt3Co Nanowires for Highly Stable and Active Electrocatalysis								ACS CATALYSIS				10	5			3018	3026		10.1021/acscatal.9b04419				MAR 6 2020	2020	One-dimensional (1D) PtM (M = Fe, Co, Ni) nanowires (NWs), which represent a thriving class of electrocatalysts for fuel cells, are experiencing a restriction in long-term durability because of the dissolving issue related to transition metals. Utilizing one-dimensional Pt3Co NWs as the basic catalyst model, here we have successfully demonstrated significant improvements in electrocatalytic durability and activity derived from doping of Ga atoms. The optimized surface energy caused by the doping of Ga atoms drives the resulting catalysts to exhibit good durability for oxygen reduction reaction (ORR) electrocatalysis. However, although oxygen binding energy (E-O) would rather deviate from the optimal value because of excessive Ga on the surface, the formation of proper Ga-O bonding can also promote oxygen binding to approach an optimal value, which results in an enhanced ORR activity. It can be therefore concluded that doping of an appropriate amount of Ga atoms has a positive effect in improving the ORR performance of the catalyst, not only in terms of specific activity but also in durability. This interesting phenomenon was also further extended to improve the catalysis of methanol oxidation (MOR) and ethanol oxidation (EOR) reactions, thus reflecting multifunctionalities of lavender-like Ga-doped Pt3Co NWs on fuel cell reactions. This study highlights the great potential of Ga-doped strategies for surface and near-surface regulation, which can effectively address the poor durability of 1D Pt-based NWs for energy catalytic technology.									23	2	0	0	0	0	24			2155-5435			WOS:000518876300013		
J	Yang, Shengwen; Bour, Christophe; Gandon, Vincent				BOUR, christophe/AAT-6998-2020; Gandon, Vincent/C-1942-2014	BOUR, christophe/0000-0001-6733-5284; Gandon, Vincent/0000-0003-1108-9410; Yang, Shengwen/0000-0001-9449-3077			Superelectrophilic Gallium(III) Homodimers in Gallium Chloride-Mediated Methylation of Benzene: A Theoretical Study								ACS CATALYSIS				10	5			3027	3033		10.1021/acscatal.9b05509				MAR 6 2020	2020	The GaCl3-mediated Friedel-Crafts alkylation of benzene by methyl chloride has been studied by means of density functional theory computations at the M062X/6-311+G(2d,2p) level of theory. The role of superelectrophilic Ga2Cl6 homodimers has been confirmed and explained. The results are consistent with the observation of second-order rate dependence in GaCl3-mediated Friedel-Crafts alkylations. This work also reveals that, even in a typical Friedel-Crafts alkylation, no Wheland-type sigma-complex can be modeled, suggesting a concerted electrophilic aromatic substitution. Also refuted is the possibility of activation of the arene nucleophile by the Lewis acid.									9	0	0	0	1	0	9			2155-5435			WOS:000518876300014		
J	Mathieu, Yann; Offen, Wendy A.; Forget, Stephanie M.; Ciano, Luisa; Viborg, Alexander Holm; Blagova, Elena; Henrissat, Bernard; Walton, Paul H.; Davies, Gideon J.; Brumer, Harry				Viborg, Alexander/AAI-4943-2021; Henrissat, Bernard/J-2475-2012; Davies, Gideon/A-9042-2011	Henrissat, Bernard/0000-0002-3434-8588; Ciano, Luisa/0000-0002-1667-0856; MATHIEU, Yann/0000-0001-6698-1911; Davies, Gideon/0000-0002-7343-776X; Walton, Paul/0000-0002-1152-1480; Brumer, Harry/0000-0002-0101-862X			Discovery of a Fungal Copper Radical Oxidase with High Catalytic Efficiency toward 5-Hydroxymethylfurfural and Benzyl Alcohols for Bioprocessing								ACS CATALYSIS				10	5			3042	3058		10.1021/acscatal.9b04727				MAR 6 2020	2020	Alternatives to petroleum-based chemicals are highly sought-after for ongoing efforts to reduce the damaging effects of human activity on the environment. Copper radical oxidases from Auxiliary Activity Family 5/Subfamily 2 (AA5_2) are attractive biocatalysts because they oxidize primary alcohols in a chemoselective manner without complex organic cofactors. However, despite numerous studies on canonical galactose oxidases (GalOx, EC 1.1.3.9) and engineered variants, and the recent discovery of a Colletotrichum graminicola copper radical alcohol oxidase (AlcOx, EC 1.1.3.13), the catalytic potentials of very few AA5_2 members have been characterized. Guided by the sequence similarity network and phylogenetic analyses, we targeted a distinct paralog from the fungus C. graminicola as a representative member of a large uncharacterized subgroup of AA5_2. Through recombinant production and detailed kinetic analysis, we demonstrated that this enzyme is weakly active toward carbohydrates but efficiently catalyzes the oxidation of aryl alcohols to the corresponding aldehydes. As such, this represents the initial characterization of a demonstrable aryl alcohol oxidase (AAO, EC 1.1.3.7) in AAS, an activity which is classically associated with Flavin-dependent glucose-methanol-choline (GMC) oxidoreductases of Auxiliary Activity Family 3 (AA3). X-ray crystallography revealed a distinct multidomain architecture comprising an N-terminal PAN domain abutting a canonical AA5 seven-bladed propeller catalytic domain. Of direct relevance to biomass processing, the wild-type enzyme exhibits the highest activity on the primary alcohol of 5-hydroxymethylfurfural (HMF), a product of significant interest in the lignocellulosic biorefinery concept. Thus, the chemoselective oxidation of HMF to 2,5-diformylfuran (DFF) by C. graminicola aryl alcohol oxidase (CgrAAO) from AAS provides a fundamental building block for chemistry via biotechnology.									12	0	0	0	5	0	12			2155-5435			WOS:000518876300016		
J	Xu, Li-Ping; Haines, Brandon E.; Ajitha, Manjaly J.; Murakami, Kei; Itami, Kenichiro; Musaev, Djamaladdin G.				Murakami, Kei/E-6804-2014; Itami, Kenichiro/B-5110-2011	Murakami, Kei/0000-0001-5405-3069; Xu, Li-Ping/0000-0001-6421-062X			Roles of Base in the Pd-Catalyzed Annulative Chlorophenylene Dimerization								ACS CATALYSIS				10	5			3059	3073		10.1021/acscatal.9b05328				MAR 6 2020	2020	The detailed mechanism of the Pd-catalyzed annulative chlorophenylene dimerization (ACD) has been elucidated and the roles of the base have been identified. It is shown that the initial steps of this reaction-the active catalyst formation and the C-Cl bond activation-proceed via the "base-assisted oxidative addition" mechanism and require only a 16.2 kcal/mol barrier. The following steps of the reaction are palladacycle and Pd-aryne formations, among which the former is favorable: it proceeds with a moderate C-H activation barrier and is slightly exergonic. Although the Pd-aryne formation requires a slightly lower energy barrier, it is highly endergonic. It is shown that the base plays important roles also in the palladacycle formation and facilitates the driving of the reaction forward by removing a proton to the solution via the bicarbonate-to-carbonate exchange mechanism. Addition of the second C-Cl bond to the thermodynamically favorable palladacycle, i.e., Pd(II)/Pd(IV) oxidation, is a rate-limiting step of the entire Pd-catalyzed and Cs-carbonate-mediated ACD reactions: it occurs with a 35.8 kcal/mol energy barrier and is exergonic by 25.1 kcal/mol. The following polycyclic aromatic hydrocarbon (PAH) formation is a multistep process and requires a lesser energy barrier. An alternative pathway, namely, cyclooctatetraene (COT) formation, requires a higher energy barrier and is not feasible. This finding is consistent with experiments that show no COT product in the utilized conditions. The calculations also indicate that the observed diminishing of the yield of the Pd-catalyzed ACD reaction upon the use of Na2CO3 instead of Cs2CO3 is the result of not only the poor solubility of Na-carbonate in the used experimental conditions but also a prohibitively large free-energy barrier required for the second C-Cl activation.									4	0	0	0	1	0	4			2155-5435			WOS:000518876300017		
J	Chen, Shuyue; Zaffran, Jeremie; Yang, Bo				Zaffran, Jeremie/AAF-5021-2021; Yang, Bo/D-2691-2012	Zaffran, Jeremie/0000-0003-3176-6140; Yang, Bo/0000-0001-6904-6646			Descriptor Design in the Computational Screening of Ni-Based Catalysts with Balanced Activity and Stability for Dry Reforming of Methane Reaction								ACS CATALYSIS				10	5			3074	3083		10.1021/acscatal.9b04429				MAR 6 2020	2020	Dry reforming of methane (DRM) is an important reaction in the actual environmental and energy crisis context. It enables the production of syngas from CO2 and CH4 reforming. While Ni catalyst presents a high activity regarding this process, it often suffers from deactivation. It was found that the Sn-doped Ni catalyst can avoid carbon deposition, but a decrease in DRM reactivity was also observed. In this work, we used density functional theory calculations in combination with microkinetic modeling first to understand how Sn doping affects the resistance to carbon deposition and the surface catalytic activities of Ni. Based on the understandings, we found that an ideal dopant should give rise to a proper adsorption energy of carbon such that (i) the C* formation process, e.g., CH4 dissociation, is rate-controlling to improve the carbon resistance and (ii) relatively low dissociation barriers of CH4 and CO2 can be achieved to maintain a good activity. Therefore, the adsorption energy of carbon and the dissociation barriers of CH4 and CO2 can be utilized as descriptors for the stability and activity of Ni-based catalysts. Subsequently, we screened several metal dopants and found that the descriptors designed are capable of providing a consistent activity and stability trend with experiments reported in the literature. Therefore, our work could provide relevant guidelines to rationally design efficient catalysts for the DRM reaction.									28	2	0	0	0	0	30			2155-5435			WOS:000518876300018		
J	Liu, Xin; Xu, Meng; Wan, Lingyun; Zhu, Hongdan; Yao, Kexin; Linguerri, Roberto; Chambaud, Gilberte; Han, Yu; Meng, Changgong				Han, Yu/N-2036-2015; Liu, Xin/G-3303-2012	Han, Yu/0000-0003-1462-1118; Liu, Xin/0000-0002-4422-4108			Superior Catalytic Performance of Atomically Dispersed Palladium on Graphene in CO Oxidation								ACS CATALYSIS				10	5			3084	3093		10.1021/acscatal.9b04840				MAR 6 2020	2020	Although substantial advances have been made in a few reactions of industrial significance over single-atom catalysts (SACs), the origin of the superior catalytic performance, the nature of the active sites, and the reaction pathways are still the subject of debate. Even for CO oxidation over SACs on nonreducible substrates, the understanding is limited. We investigated the performance of Pd atoms monodispersed on graphene (PdGr) in CO oxidation. Combining first-principles-based thermodynamics calculations and microkinetics modeling, we showed that the positively charged PdGr can exhibit a rather high low-temperature activity in CO oxidation. Under reaction conditions, the Pd atom binds strongly with 02, acting as the reactive species to convert CO. A comparison of the conversion rates of steps along different potential reaction pathways provides direct evidence that CO oxidation mainly proceeds through revised Langmuir-Hinshelwood pathways, and the dissociation of the peroxide intermediate (O-O-C=O) is the rate limiting step. The predicted catalytic performance was attributed to the specific electronic structure of PdGr with the positively charged Pd on graphene monovacancy exposing sp-type frontier states. We expect these findings to help in understanding the performance of SACs and to guide the design and fabrication of SACs with superior catalytic performance.									17	0	0	0	0	0	17			2155-5435			WOS:000518876300019		
J	Bhagat, Ashok Kumar; Buium, Hadar; Shmul, Guy; Alfonta, Lital								Genetically Expanded Reactive-Oxygen-Tolerant Alcohol Dehydrogenase II								ACS CATALYSIS				10	5			3094	3102		10.1021/acscatal.9b03739				MAR 6 2020	2020	Herein, we report the site-specific incorporation of L-3,4-dihydroxyphenylalanine as a promising method to engineer an oxygen-tolerant alcohol dehydrogenase II. The engineered mutant alcohol dehydrogenase II binds Zn2+ with high binding affinity and is functional under aerobic and oxidative conditions for a longer time than the wild-type, Fe2+-binding alcohol dehydrogenase II. Overall, the mutant enzyme demonstrated electrochemical activity toward both acetaldehyde reduction and ethanol oxidation reactions. This enzyme could have a potential use in efficient biofuel production under aerobic conditions in photosynthetic organisms despite the inherent oxygen evolution reaction by photosystem II.									3	0	0	0	2	0	3			2155-5435			WOS:000518876300020		
J	Kou, Xuezhen; Kou, Kevin G. M.				Kou, Kevin GM/A-5046-2015	Kou, Kevin GM/0000-0002-4676-8846			alpha-Arylation of Silyl Enol Ethers via Rhodium(III)-Catalyzed C-H Functionalization								ACS CATALYSIS				10	5			3103	3109		10.1021/acscatal.9b05622				MAR 6 2020	2020	Carbon-hydrogen (C-H) bond functionalization streamlines synthesis by increasing step- and atom-economies. This approach, catalyzed by Rh(III), is combined with the alpha-arylation of ketone-derived silyl enol ethers to achieve a direct cross-coupling event. The advancement of electron-rich alkenes as substrates is enabled through the use of a silver additive and complements existing C-H activation methods that transform enol ester derivatives and electron-deficient alkenes. A Rh(III)/(V)/(III) catalytic cycle is proposed to rationalize mechanistic observations.									9	0	0	0	3	0	9			2155-5435			WOS:000518876300021		
J	Sutiono, Samuel; Teshima, Mariko; Beer, Barbara; Schenk, Gerhard; Sieber, Volker				Sieber, Volker/D-2006-2013	Sieber, Volker/0000-0001-5458-9330; Schenk, Gerhard/0000-0001-8619-0631; Sutiono, Samuel/0000-0002-7874-7732			Enabling the Direct Enzymatic Dehydration of D-Glycerate to Pyruvate as the Key Step in Synthetic Enzyme Cascades Used in the Cell-Free Production of Fine Chemicals								ACS CATALYSIS				10	5			3110	3118		10.1021/acscatal.9b05068				MAR 6 2020	2020	A high degree of dependence on fossil fuels is one of the major problems faced by modern societies. D-Glucose and glycerol have emerged in recent years as prospective replacements for fossil fuels used in the production of high-value chemicals, and cell-free bioproduction routes are expected to play a crucial role in such processes. Recently, several synthetic cascades used for the cell-free biotransformations of D-glucose and glycerol to pyruvate and beyond have been described. However, these were limited by the very slow dehydration step of D-glycerate to pyruvate catalyzed by a dehydratase from Sulfolobus solfataricus (SsDHAD), making this step by far the major bottleneck. By combining the vast number of available genomes with a sequence-based discovery approach, we have identified signature sequences leading to the discovery of two distinct classes of dehydratases which exhibit promising activity and total turnover number (TTN) toward D-glycerate. In particular, the dehydratase from Paralcaligenes ureilyticus (PuDHT) demonstrated >100-fold higher activity and TTN for D-glycerate in comparison to SsDHAD. In addition, PuDHT showed exceptionally high activity and TTN toward D-gluconate. The replacement of SsDHAD by PuDHT in our model cascade from D-glucose to ethanol enhanced the production rate 10-fold, reaching a 92% theoretical yield at 50 degrees C. PuDHT was also suitable for the conversion of glycerol to pyruvate at ambient temperature, leading to a >5-fold improvement in production rate in comparison to the system utilizing SsDHAD at 50 degrees C and attaining 97% of the theoretical yield. PuDHT was also compatible when crude glycerol was used as the substrate, and it no longer caused a bottleneck in the enzymatic cascade.									7	0	0	0	1	0	7			2155-5435			WOS:000518876300022		
J	Gruenert, Wolfgang; Ganesha, Padmalekha Kydala; Ellmers, Inga; Velez, Roxana Perez; Huang, Heming; Bentrup, Ursula; Schuenemann, Volker; Brueckner, Angelika					Bruckner, Angelika/0000-0003-4647-1273			Active Sites of the Selective Catalytic Reduction of NO by NH3 over Fe-ZSM-5: Combining Reaction Kinetics with Postcatalytic Mossbauer Spectroscopy at Cryogenic Temperatures								ACS CATALYSIS				10	5			3119	3130		10.1021/acscatal.9b04627				MAR 6 2020	2020	Fe-57-ZSM-S catalysts were prepared by solid-state ion exchange of (FeCl3)-Fe-57 into H-ZSM-5, the exchange capacity of which had been blocked by Na+ or Ca2+ to approximate to 50, approximate to 25, and 0%. Their Fe site structure was investigated by UV-vis, electron paramagnetic resonance (EPR), and Mossbauer spectroscopy at different temperatures including cryogenic conditions, and their selective catalytic reduction (SCR) activity was studied between 400 and 870 K. Mossbauer analysis was performed by establishing consistent models that well represent cryogenic measurements at low and high magnetic fields (10 mT and 5 T, respectively) but also low-field measurements at higher temperatures, which were performed in order to evaluate their analytical potential. It was found that a reliable analysis in particular of species in small structures (binary, oligomeric sites) requires modeling of cryogenic Mossbauer data with spin-Hamiltonian formalism, which needs to be combined with input from EPR spectroscopy for specifying/confining the type of paramagnetic Fe-III site to be included in the model. Spin-Hamiltonian formalism (combined with input from EPR) can be applied also to measurements at higher temperatures where reliable results for paramagnetic Fe-III and Fe-II sites and for the sum of superparamagnetic Fe-III species and particles can be obtained from spectra measured at 77 K. While qualitative observations in EPR spectra of initial samples were in good agreement with quantitative site abundances obtained from the Mossbauer spectra, there were significant deviations between the latter and results from UV-vis measurements. Mossbauer-derived site distributions in postcatalytic samples (after reaction at 670 K) showed that the standard SCR rate correlates well with the abundance of oligomeric Fe-III oxo sites, in particular with binary Fe-III-O-Fe-III structures, although an intercept may indicate a minor relevance of an additional species. The clear correlation between rates and abundance of Fe-III sites rejects reoxidation as a rate-limiting step for the given catalysts and reaction conditions.									2	0	0	0	0	0	2			2155-5435			WOS:000518876300023		
J	Fichtner, Johannes; Watzele, Sebastian; Garlyyev, Batyr; Kluge, Regina M.; Haimerl, Felix; El-Sayed, Hany A.; Li, Wei-Jin; Maillard, Frederic M.; Dubau, Laetitia; Chattot, Raphael; Michalicka, Jan; Macak, Jan M.; Wang, Wu; Wang, Di; Gigl, Thomas; Hugenschmidt, Christoph; Bandarenka, Aliaksandr S.				Hugenschmidt, Christoph/K-3566-2017; Li, Wei-Jin/E-3570-2016; Elsayed, Hany/AAJ-8233-2020; Bandarenka, Aliaksandr/AAO-1553-2021; Maillard, Frederic/C-7954-2012	Hugenschmidt, Christoph/0000-0002-0056-8953; Li, Wei-Jin/0000-0002-5850-1241; Elsayed, Hany/0000-0002-8769-8258; Maillard, Frederic/0000-0002-6470-8900			Tailoring the Oxygen Reduction Activity of Pt Nanoparticles through Surface Defects: A Simple Top-Down Approach								ACS CATALYSIS				10	5			3131	3142		10.1021/acscatal.9b04974				MAR 6 2020	2020	Results from Pt model catalyst surfaces have demonstrated that surface defects, in particular surface concavities, can improve the oxygen reduction reaction (ORR) kinetics. It is, however, a challenging task to synthesize nanostructured catalysts with such defective surfaces. Hence, we present a one-step and upscalable top-down approach to produce a Pt/C catalyst (with similar to 3 nm Pt nanoparticle diameter). Using high-resolution transmission electron microscopy and tomography, electrochemical techniques, high-energy X-ray measurements, and positron annihilation spectroscopy, we provide evidence of a high density of surface defects (including surface concavities). The ORR activity of the developed catalyst exceeds that of a commercial Pt/C catalyst, at least 2.7 times in terms of specific activity (similar to 1.62 mA/cm(Pt)(2), at 0.9 V vs the reversible hydrogen electrode) and at least 1.7 times in terms of mass activity (similar to 712 mA/mg(Pt)), which can be correlated to the enhanced amount of surface defects. In addition, the technique used here reduces the complexity of the synthesis (and therefore production costs) in comparison to state of the art bottom-up techniques.									18	2	0	0	1	0	18			2155-5435			WOS:000518876300024		
J	Zhang, Hongxia; Tian, Shaixiao; Yue, Yue; Li, Min; Tong, Wei; Xu, Guangyu; Chen, Bo; Ma, Ming; Li, Yanwei; Wang, Jian-bo				Li, Yanwei/P-1920-2019	Li, Yanwei/0000-0003-4089-9789; Wang, Jian-bo/0000-0003-1154-8437			Semirational Design of Fluoroacetate Dehalogenase RPA1163 for Kinetic Resolution of alpha-Fluorocarboxylic Acids on a Gram Scale								ACS CATALYSIS				10	5			3143	3151		10.1021/acscatal.9b04804				MAR 6 2020	2020	Here the synthetic utility of fluoroacetate dchalogenase RPA1163 is explored for the production of enantiomerically pure (R)-alpha-fluorocarboxylic acids and (R)-alpha-hydroxylcarboxylic acids via kinetic resolution of racemic alpha-fluorocarboxylic acids. While wild-type (WT) RPA1163 shows high thermostability and fairly wide substrate scope, many interesting yet poorly or moderately accepted substrates exist. In order to solve this problem and to develop upscaled production, in silico calculations and semirational mutagenesis were employed. Residue W185 was engineered to alanine, serine, threonine, or asparagine. The two best mutants, W185N and W185T, showed significantly improved performance in the reactions of these substrates, while in silico calculations shed light on the origin of these improvements. Finally, 10 alpha-fluorocarboxylic acids and 10 alpha-hydroxycarboxylic acids were prepared on a gram scale via kinetic resolution enabled by WT, W185T, or WI 85N. This work expands the biocatalytic toolbox and allows a deep insight into the fluoroacetate dehalogenase catalyzed C-F cleavage mechanism.									8	1	0	0	6	0	9			2155-5435			WOS:000518876300025		
J	Ohmura, Toshimichi; Yagi, Kaito; Kusaka, Satoshi; Suginome, Michinori				Ohmura, Toshimichi/P-9179-2018	Ohmura, Toshimichi/0000-0002-2534-3769			Tandem C-H Transformations by a Single Iridium Catalyst: Direct Access to Indoles and Indolines from o-Alkyl-N-methylanilines								ACS CATALYSIS				10	5			3152	3157		10.1021/acscatal.9b05579				MAR 6 2020	2020	In the presence of an iridium catalyst bearing DTBM-SEGPHOS as a ligand and tert-butylethylene as a hydrogen scavenger, 2-ethyl-N-methylanilines were converted directly to 3-methylindoles in high yields. The reaction proceeded efficiently in mesitylene at 150 degrees C through transfer dehydrogenation of the ethyl group and following intramolecular dehydrogenative C-H/C-H coupling of the N-methyl group with the vinyl group formed in situ. The iridium catalyst system was applied to the asymmetric conversion affording enantioenriched indolines bearing a quaternary stereogenic carbon center at the C3 position.									4	0	0	0	1	0	4			2155-5435			WOS:000518876300026		
