PMID,Title,Authors,Citation,First Author,Journal/Book,Publication Year,Create Date,PMCID,NIHMS ID,DOI
"34086856","iAMP-CA2L: a new CNN-BiLSTM-SVM classifier based on cellular automata image for identifying antimicrobial peptides and their functional types","Xiao X, Shao YT, Cheng X, Stamatovic B.","Brief Bioinform. 2021 Nov 5;22(6):bbab209. doi: 10.1093/bib/bbab209.","Xiao X","Brief Bioinform","2021","2021/06/04","","","10.1093/bib/bbab209"
"34322702","Addressing data imbalance problems in ligand-binding site prediction using a variational autoencoder and a convolutional neural network","Nguyen TT, Nguyen DK, Ou YY.","Brief Bioinform. 2021 Nov 5;22(6):bbab277. doi: 10.1093/bib/bbab277.","Nguyen TT","Brief Bioinform","2021","2021/07/29","","","10.1093/bib/bbab277"
"33569598","Integrated network analysis reveals new genes suggesting COVID-19 chronic effects and treatment","Pavel A, Del Giudice G, Federico A, Di Lieto A, Kinaret PAS, Serra A, Greco D.","Brief Bioinform. 2021 Mar 22;22(2):1430-1441. doi: 10.1093/bib/bbaa417.","Pavel A","Brief Bioinform","2021","2021/02/11","PMC7929418","","10.1093/bib/bbaa417"
"34953466","Letter to the Editor: on the stability and internal consistency of component-wise sparse mixture regression-based clustering","Zhang B, He J, Hu J, Koestler DC, Chalise P.","Brief Bioinform. 2021 Dec 26:bbab532. doi: 10.1093/bib/bbab532. Online ahead of print.","Zhang B","Brief Bioinform","2021","2021/12/25","","","10.1093/bib/bbab532"
"34184738","DeepIPs: comprehensive assessment and computational identification of phosphorylation sites of SARS-CoV-2 infection using a deep learning-based approach","Lv H, Dao FY, Zulfiqar H, Lin H.","Brief Bioinform. 2021 Nov 5;22(6):bbab244. doi: 10.1093/bib/bbab244.","Lv H","Brief Bioinform","2021","2021/06/29","PMC8406875","","10.1093/bib/bbab244"
"33569580","Computational approaches to amino acid side-chain conformation using combined NMR theoretical and experimental results: leucine-67 in Desulfovibrio vulgaris flavodoxin","San Fabián J, Omar S, García de la Vega JM.","Brief Bioinform. 2021 Sep 2;22(5):bbab020. doi: 10.1093/bib/bbab020.","San Fabián J","Brief Bioinform","2021","2021/02/11","","","10.1093/bib/bbab020"
"34368843","A gentle introduction to understanding preclinical data for cancer pharmaco-omic modeling","Piyawajanusorn C, Nguyen LC, Ghislat G, Ballester PJ.","Brief Bioinform. 2021 Nov 5;22(6):bbab312. doi: 10.1093/bib/bbab312.","Piyawajanusorn C","Brief Bioinform","2021","2021/08/09","","","10.1093/bib/bbab312"
"34260682","oncoPredict: an R package for predicting in vivo or cancer patient drug response and biomarkers from cell line screening data","Maeser D, Gruener RF, Huang RS.","Brief Bioinform. 2021 Nov 5;22(6):bbab260. doi: 10.1093/bib/bbab260.","Maeser D","Brief Bioinform","2021","2021/07/14","PMC8574972","","10.1093/bib/bbab260"
"34535795","Network-based analysis revealed significant interactions between risk genes of severe COVID-19 and host genes interacted with SARS-CoV-2 proteins","Qi HX, Shen QD, Zhao HY, Qi GZ, Gao L.","Brief Bioinform. 2021 Sep 17:bbab372. doi: 10.1093/bib/bbab372. Online ahead of print.","Qi HX","Brief Bioinform","2021","2021/09/18","","","10.1093/bib/bbab372"
"33839756","iSMNN: batch effect correction for single-cell RNA-seq data via iterative supervised mutual nearest neighbor refinement","Yang Y, Li G, Xie Y, Wang L, Lagler TM, Yang Y, Liu J, Qian L, Li Y.","Brief Bioinform. 2021 Sep 2;22(5):bbab122. doi: 10.1093/bib/bbab122.","Yang Y","Brief Bioinform","2021","2021/04/11","PMC8579191","","10.1093/bib/bbab122"
"33681983","Knowledge-based classification of fine-grained immune cell types in single-cell RNA-Seq data","Liu X, Gosline SJC, Pflieger LT, Wallet P, Iyer A, Guinney J, Bild AH, Chang JT.","Brief Bioinform. 2021 Sep 2;22(5):bbab039. doi: 10.1093/bib/bbab039.","Liu X","Brief Bioinform","2021","2021/03/08","PMC8536868","","10.1093/bib/bbab039"
"34849565","Quantitative model suggests both intrinsic and contextual features contribute to the transcript coding ability determination in cells","Kang YJ, Li JY, Ke L, Jiang S, Yang DC, Hou M, Gao G.","Brief Bioinform. 2021 Nov 28:bbab483. doi: 10.1093/bib/bbab483. Online ahead of print.","Kang YJ","Brief Bioinform","2021","2021/12/01","","","10.1093/bib/bbab483"
"33979434","MHCBI: a pipeline for calculating peptide-MHC binding energy using semi-empirical quantum mechanical methods with explicit/implicit solvent models","Ortiz-Mahecha CA, Agudelo WA, Patarroyo MA, Patarroyo ME, Suárez CF.","Brief Bioinform. 2021 Nov 5;22(6):bbab171. doi: 10.1093/bib/bbab171.","Ortiz-Mahecha CA","Brief Bioinform","2021","2021/05/12","","","10.1093/bib/bbab171"
"34655289","Artificial intelligence for drug response prediction in disease models","Ballester PJ, Stevens R, Haibe-Kains B, Huang RS, Aittokallio T.","Brief Bioinform. 2021 Oct 15:bbab450. doi: 10.1093/bib/bbab450. Online ahead of print.","Ballester PJ","Brief Bioinform","2021","2021/10/16","","","10.1093/bib/bbab450"
"34125166","Knowledge bases and software support for variant interpretation in precision oncology","Borchert F, Mock A, Tomczak A, Hügel J, Alkarkoukly S, Knurr A, Volckmar AL, Stenzinger A, Schirmacher P, Debus J, Jäger D, Longerich T, Fröhling S, Eils R, Bougatf N, Sax U, Schapranow MP.","Brief Bioinform. 2021 Nov 5;22(6):bbab246. doi: 10.1093/bib/bbab246.","Borchert F","Brief Bioinform","2021","2021/06/14","PMC8575010","","10.1093/bib/bbab246"
"34015811","Strand Orientation Bias Detector to determine the probability of FFPE sequencing artifacts","Diossy M, Sztupinszki Z, Krzystanek M, Borcsok J, Eklund AC, Csabai I, Pedersen AG, Szallasi Z.","Brief Bioinform. 2021 Nov 5;22(6):bbab186. doi: 10.1093/bib/bbab186.","Diossy M","Brief Bioinform","2021","2021/05/20","","","10.1093/bib/bbab186"
"34226916","Erratum to: Analysis, identification and visualization of subgroups in genomics","Völkel G, Laban S, Fürstberger A, Kühlwein SD, Ikonomi N, Hoffmann TK, Brunner C, Neuberg DS, Gaidzik V, Döhner H, Kraus JM, Kestler HA.","Brief Bioinform. 2021 Nov 5;22(6):bbab280. doi: 10.1093/bib/bbab280.","Völkel G","Brief Bioinform","2021","2021/07/06","PMC8575006","","10.1093/bib/bbab280"
"34499131","Erratum to: Evaluation of in silico tools for the prediction of protein and peptide aggregation on diverse datasets","Prabakaran R, Rawat P, Kumar S, Gromiha MM.","Brief Bioinform. 2021 Sep 9:bbab369. doi: 10.1093/bib/bbab369. Online ahead of print.","Prabakaran R","Brief Bioinform","2021","2021/09/09","","","10.1093/bib/bbab369"
"34056652","Erratum to: Identification of multiple RNAs using feature fusion","Singh D, Madhawan A, Roy J.","Brief Bioinform. 2021 Nov 5;22(6):bbab218. doi: 10.1093/bib/bbab218.","Singh D","Brief Bioinform","2021","2021/05/31","","","10.1093/bib/bbab218"
"34897382","Erratum to: Machine learning meets omics applications and perspectives","Li R, Li L, Xu Y, Yang J.","Brief Bioinform. 2021 Dec 10:bbab560. doi: 10.1093/bib/bbab560. Online ahead of print.","Li R","Brief Bioinform","2021","2021/12/13","","","10.1093/bib/bbab560"
"34524417","Corrigendum to: Machine learning approach to gene essentiality prediction: a review","Aromolaran O, Aromolaran D, Isewon I, Oyelade J.","Brief Bioinform. 2021 Sep 15:bbab419. doi: 10.1093/bib/bbab419. Online ahead of print.","Aromolaran O","Brief Bioinform","2021","2021/09/15","","","10.1093/bib/bbab419"
"34251019","Erratum to: Evotuning protocols for Transformer-based variant effect prediction on multi-domain proteins","Yamaguchi H, Saito Y.","Brief Bioinform. 2021 Nov 5;22(6):bbab287. doi: 10.1093/bib/bbab287.","Yamaguchi H","Brief Bioinform","2021","2021/07/12","","","10.1093/bib/bbab287"
"34128528","Erratum: usDSM: a novel method for deleterious synonymous mutation prediction using undersampling scheme","Tang X, Zhang T, Cheng N, Wang H, Zheng CH, Xia J, Zhang T.","Brief Bioinform. 2021 Nov 5;22(6):bbab247. doi: 10.1093/bib/bbab247.","Tang X","Brief Bioinform","2021","2021/06/15","","","10.1093/bib/bbab247"
"34050369","Corrigendum to: Evaluation of machine learning approaches for cell-type identification from single-cell transcriptomics data","Huang Y, Zhang P.","Brief Bioinform. 2021 Nov 5;22(6):bbab217. doi: 10.1093/bib/bbab217.","Huang Y","Brief Bioinform","2021","2021/05/29","","","10.1093/bib/bbab217"
"33511980","Corrigendum to: FunRes: resolving tissue-specific functional cell states based on a cell-cell communication network model","Jung S, Singh K, Del Sol A.","Brief Bioinform. 2021 Sep 2;22(5):bbab018. doi: 10.1093/bib/bbab018.","Jung S","Brief Bioinform","2021","2021/01/29","PMC8425423","","10.1093/bib/bbab018"
"33885743","Corrigendum to: Systemic effects of missense mutations on SARS-CoV-2 spike glycoprotein stability and receptor-binding affinity","Teng S, Sobitan A, Rhoades R, Liu D, Tang Q.","Brief Bioinform. 2021 Sep 2;22(5):bbab176. doi: 10.1093/bib/bbab176.","Teng S","Brief Bioinform","2021","2021/04/22","PMC8083187","","10.1093/bib/bbab176"
"34278426","Corrigendum to: Computational design of ultrashort peptide inhibitors of the receptor-binding domain of the SARS-CoV-2 S protein","Pei P, Qin H, Chen J, Wang F, He C, He S, Hong B, Liu K, Qiao R, Fan H, Tong Y, Chen L, Luo SZ.","Brief Bioinform. 2021 Nov 5;22(6):bbab298. doi: 10.1093/bib/bbab298.","Pei P","Brief Bioinform","2021","2021/07/19","PMC8344479","","10.1093/bib/bbab298"
"33899096","Erratum to: Comprehensive benchmarking of software for mapping whole genome bisulfite data: from read alignment to DNA methylation analysis","Nunn A, Otto C, Stadler PF, Langenberger D.","Brief Bioinform. 2021 Sep 2;22(5):bbab183. doi: 10.1093/bib/bbab183.","Nunn A","Brief Bioinform","2021","2021/04/26","PMC8425262","","10.1093/bib/bbab183"
"33517357","An end-to-end heterogeneous graph representation learning-based framework for drug-target interaction prediction","Peng J, Wang Y, Guan J, Li J, Han R, Hao J, Wei Z, Shang X.","Brief Bioinform. 2021 Sep 2;22(5):bbaa430. doi: 10.1093/bib/bbaa430.","Peng J","Brief Bioinform","2021","2021/01/31","","","10.1093/bib/bbaa430"
"33515030","HVIDB: a comprehensive database for human-virus protein-protein interactions","Yang X, Lian X, Fu C, Wuchty S, Yang S, Zhang Z.","Brief Bioinform. 2021 Mar 22;22(2):832-844. doi: 10.1093/bib/bbaa425.","Yang X","Brief Bioinform","2021","2021/01/30","","","10.1093/bib/bbaa425"
"33515011","XGSEA: CROSS-species gene set enrichment analysis via domain adaptation","Cai M, Hao Nguyen C, Mamitsuka H, Li L.","Brief Bioinform. 2021 Sep 2;22(5):bbaa406. doi: 10.1093/bib/bbaa406.","Cai M","Brief Bioinform","2021","2021/01/30","","","10.1093/bib/bbaa406"
"33497435","ExonSkipAD provides the functional genomic landscape of exon skipping events in Alzheimer's disease","Yang M, Ke Y, Kim P, Zhou X.","Brief Bioinform. 2021 Sep 2;22(5):bbaa438. doi: 10.1093/bib/bbaa438.","Yang M","Brief Bioinform","2021","2021/01/26","PMC8425305","","10.1093/bib/bbaa438"
"33480420","Hybrid modelling of biological systems using fuzzy continuous Petri nets","Liu F, Sun W, Heiner M, Gilbert D.","Brief Bioinform. 2021 Jan 18;22(1):438-450. doi: 10.1093/bib/bbz114.","Liu F","Brief Bioinform","2021","2021/01/22","PMC7820864","","10.1093/bib/bbz114"
"33479725","An integrated approach to determine the abundance, mutation rate and phylogeny of the SARS-CoV-2 genome","Desai S, Rashmi S, Rane A, Dharavath B, Sawant A, Dutt A.","Brief Bioinform. 2021 Mar 22;22(2):1065-1075. doi: 10.1093/bib/bbaa437.","Desai S","Brief Bioinform","2021","2021/01/22","PMC7929363","","10.1093/bib/bbaa437"
"33458761","Bioinformatics and system biology approach to identify the influences of COVID-19 on cardiovascular and hypertensive comorbidities","Nashiry A, Sarmin Sumi S, Islam S, Quinn JMW, Moni MA.","Brief Bioinform. 2021 Mar 22;22(2):1387-1401. doi: 10.1093/bib/bbaa426.","Nashiry A","Brief Bioinform","2021","2021/01/18","PMC7929376","","10.1093/bib/bbaa426"
"33458747","Serial co-expression analysis of host factors from SARS-CoV viruses highly converges with former high-throughput screenings and proposes key regulators","Pérez-Pulido AJ, Asencio-Cortés G, Brokate-Llanos AM, Brea-Calvo G, Rodríguez-Griñolo R, Garzón A, Muñoz MJ.","Brief Bioinform. 2021 Mar 22;22(2):1038-1052. doi: 10.1093/bib/bbaa419.","Pérez-Pulido AJ","Brief Bioinform","2021","2021/01/18","PMC7929451","","10.1093/bib/bbaa419"
"33454758","Application of learning to rank in bioinformatics tasks","Ru X, Ye X, Sakurai T, Zou Q.","Brief Bioinform. 2021 Sep 2;22(5):bbaa394. doi: 10.1093/bib/bbaa394.","Ru X","Brief Bioinform","2021","2021/01/17","","","10.1093/bib/bbaa394"
"33432321","Bioinformatics resources facilitate understanding and harnessing clinical research of SARS-CoV-2","Ahsan MA, Liu Y, Feng C, Zhou Y, Ma G, Bai Y, Chen M.","Brief Bioinform. 2021 Mar 22;22(2):714-725. doi: 10.1093/bib/bbaa416.","Ahsan MA","Brief Bioinform","2021","2021/01/12","PMC7929412","","10.1093/bib/bbaa416"
"33418562","Accuracy or novelty: what can we gain from target-specific machine-learning-based scoring functions in virtual screening?","Shen C, Weng G, Zhang X, Leung EL, Yao X, Pang J, Chai X, Li D, Wang E, Cao D, Hou T.","Brief Bioinform. 2021 Sep 2;22(5):bbaa410. doi: 10.1093/bib/bbaa410.","Shen C","Brief Bioinform","2021","2021/01/08","","","10.1093/bib/bbaa410"
"33423051","CNA2Subpathway: identification of dysregulated subpathway driven by copy number alterations in cancer","Sheng Y, Jiang Y, Yang Y, Li X, Qiu J, Wu J, Cheng L, Han J.","Brief Bioinform. 2021 Sep 2;22(5):bbaa413. doi: 10.1093/bib/bbaa413.","Sheng Y","Brief Bioinform","2021","2021/01/10","","","10.1093/bib/bbaa413"
"33401308","Integrative bioinformatics and omics data source interoperability in the next-generation sequencing era-Editorial","Rombo SE, Ursino D.","Brief Bioinform. 2021 Jan 18;22(1):1-2. doi: 10.1093/bib/bbaa398.","Rombo SE","Brief Bioinform","2021","2021/01/05","","","10.1093/bib/bbaa398"
"33381797","ChemGenerator: a web server for generating potential ligands for specific targets","Yang J, Hou L, Liu KM, He WB, Cai Y, Yang FQ, Hu YJ.","Brief Bioinform. 2021 Jul 20;22(4):bbaa407. doi: 10.1093/bib/bbaa407.","Yang J","Brief Bioinform","2021","2020/12/31","","","10.1093/bib/bbaa407"
"33348368","A review on viral data sources and search systems for perspective mitigation of COVID-19","Bernasconi A, Canakoglu A, Masseroli M, Pinoli P, Ceri S.","Brief Bioinform. 2021 Mar 22;22(2):664-675. doi: 10.1093/bib/bbaa359.","Bernasconi A","Brief Bioinform","2021","2020/12/21","PMC7799334","","10.1093/bib/bbaa359"
"33348366","Topological network measures for drug repositioning","Badkas A, De Landtsheer S, Sauter T.","Brief Bioinform. 2021 Jul 20;22(4):bbaa357. doi: 10.1093/bib/bbaa357.","Badkas A","Brief Bioinform","2021","2020/12/21","PMC8294518","","10.1093/bib/bbaa357"
"33341893","A comprehensive survey on computational methods of non-coding RNA and disease association prediction","Lei X, Mudiyanselage TB, Zhang Y, Bian C, Lan W, Yu N, Pan Y.","Brief Bioinform. 2021 Jul 20;22(4):bbaa350. doi: 10.1093/bib/bbaa350.","Lei X","Brief Bioinform","2021","2020/12/20","","","10.1093/bib/bbaa350"
"33333549","idenPC-CAP: Identify protein complexes from weighted RNA-protein heterogeneous interaction networks using co-assemble partner relation","Wu Z, Liao Q, Fan S, Liu B.","Brief Bioinform. 2021 Jul 20;22(4):bbaa372. doi: 10.1093/bib/bbaa372.","Wu Z","Brief Bioinform","2021","2020/12/17","","","10.1093/bib/bbaa372"
"33320936","Protein subcellular localization based on deep image features and criterion learning strategy","Su R, He L, Liu T, Liu X, Wei L.","Brief Bioinform. 2021 Jul 20;22(4):bbaa313. doi: 10.1093/bib/bbaa313.","Su R","Brief Bioinform","2021","2020/12/15","","","10.1093/bib/bbaa313"
"33320931","Unveiling the immune infiltrate modulation in cancer and response to immunotherapy by MIXTURE-an enhanced deconvolution method","Fernández EA, Mahmoud YD, Veigas F, Rocha D, Miranda M, Merlo J, Balzarini M, Lujan HD, Rabinovich GA, Girotti MR.","Brief Bioinform. 2021 Jul 20;22(4):bbaa317. doi: 10.1093/bib/bbaa317.","Fernández EA","Brief Bioinform","2021","2020/12/15","PMC8294562","","10.1093/bib/bbaa317"
"33316063","A genome-wide association study to identify candidate genes for erectile dysfunction","Kazemi E, Zargooshi J, Kaboudi M, Heidari P, Kahrizi D, Mahaki B, Mohammadian Y, Khazaei H, Ahmed K.","Brief Bioinform. 2021 Jul 20;22(4):bbaa338. doi: 10.1093/bib/bbaa338.","Kazemi E","Brief Bioinform","2021","2020/12/14","","","10.1093/bib/bbaa338"
"33316046","Goals and approaches for each processing step for single-cell RNA sequencing data","Zhang Z, Cui F, Wang C, Zhao L, Zou Q.","Brief Bioinform. 2021 Jul 20;22(4):bbaa314. doi: 10.1093/bib/bbaa314.","Zhang Z","Brief Bioinform","2021","2020/12/14","","","10.1093/bib/bbaa314"
"33316035","Large-scale comparative review and assessment of computational methods for anti-cancer peptide identification","Liang X, Li F, Chen J, Li J, Wu H, Li S, Song J, Liu Q.","Brief Bioinform. 2021 Jul 20;22(4):bbaa312. doi: 10.1093/bib/bbaa312.","Liang X","Brief Bioinform","2021","2020/12/14","PMC8294543","","10.1093/bib/bbaa312"
"33313714","A systematic analysis of miRNA markers and classification algorithms for forensic body fluid identification","Liu Y, He H, Xiao ZX, Ji A, Ye J, Sun Q, Cao Y.","Brief Bioinform. 2021 Jul 20;22(4):bbaa324. doi: 10.1093/bib/bbaa324.","Liu Y","Brief Bioinform","2021","2020/12/14","","","10.1093/bib/bbaa324"
"33313694","Target shortage and less explored multiple targeting: hurdles in the development of novel antifungals but overcome/addressed effectively through structural bioinformatics","Jha A, Vimal A, Kumar A.","Brief Bioinform. 2021 Jul 20;22(4):bbaa343. doi: 10.1093/bib/bbaa343.","Jha A","Brief Bioinform","2021","2020/12/14","","","10.1093/bib/bbaa343"
"33300547","scGMAI: a Gaussian mixture model for clustering single-cell RNA-Seq data based on deep autoencoder","Yu B, Chen C, Qi R, Zheng R, Skillman-Lawrence PJ, Wang X, Ma A, Gu H.","Brief Bioinform. 2021 Jul 20;22(4):bbaa316. doi: 10.1093/bib/bbaa316.","Yu B","Brief Bioinform","2021","2020/12/10","","","10.1093/bib/bbaa316"
"33285568","FEATS: feature selection-based clustering of single-cell RNA-seq data","Vans E, Patil A, Sharma A.","Brief Bioinform. 2021 Jul 20;22(4):bbaa306. doi: 10.1093/bib/bbaa306.","Vans E","Brief Bioinform","2021","2020/12/07","","","10.1093/bib/bbaa306"
"33285567","Design of an epitope-based peptide vaccine against the SARS-CoV-2: a vaccine-informatics approach","Alam A, Khan A, Imam N, Siddiqui MF, Waseem M, Malik MZ, Ishrat R.","Brief Bioinform. 2021 Mar 22;22(2):1309-1323. doi: 10.1093/bib/bbaa340.","Alam A","Brief Bioinform","2021","2020/12/07","PMC7799329","","10.1093/bib/bbaa340"
"33279962","Coupled co-clustering-based unsupervised transfer learning for the integrative analysis of single-cell genomic data","Zeng P, Wangwu J, Lin Z.","Brief Bioinform. 2021 Jul 20;22(4):bbaa347. doi: 10.1093/bib/bbaa347.","Zeng P","Brief Bioinform","2021","2020/12/06","","","10.1093/bib/bbaa347"
"33264391","NetCoMi: network construction and comparison for microbiome data in R","Peschel S, Müller CL, von Mutius E, Boulesteix AL, Depner M.","Brief Bioinform. 2021 Jul 20;22(4):bbaa290. doi: 10.1093/bib/bbaa290.","Peschel S","Brief Bioinform","2021","2020/12/02","PMC8293835","","10.1093/bib/bbaa290"
"33230549","SSMD: a semi-supervised approach for a robust cell type identification and deconvolution of mouse transcriptomics data","Lu X, Tu SW, Chang W, Wan C, Wang J, Zang Y, Ramdas B, Kapur R, Lu X, Cao S, Zhang C.","Brief Bioinform. 2021 Jul 20;22(4):bbaa307. doi: 10.1093/bib/bbaa307.","Lu X","Brief Bioinform","2021","2020/11/24","PMC8294548","","10.1093/bib/bbaa307"
"33201188","ChemFLuo: a web-server for structure analysis and identification of fluorescent compounds","Yang ZY, Dong J, Yang ZJ, Yin M, Jiang HL, Lu AP, Chen X, Hou TJ, Cao DS.","Brief Bioinform. 2021 Jul 20;22(4):bbaa282. doi: 10.1093/bib/bbaa282.","Yang ZY","Brief Bioinform","2021","2020/11/17","","","10.1093/bib/bbaa282"
"33201180","Are dropout imputation methods for scRNA-seq effective for scHi-C data?","Han C, Xie Q, Lin S.","Brief Bioinform. 2021 Jul 20;22(4):bbaa289. doi: 10.1093/bib/bbaa289.","Han C","Brief Bioinform","2021","2020/11/17","PMC8293815","","10.1093/bib/bbaa289"
"33201177","Tracing the footsteps of autophagy in computational biology","Sarmah DT, Bairagi N, Chatterjee S.","Brief Bioinform. 2021 Jul 20;22(4):bbaa286. doi: 10.1093/bib/bbaa286.","Sarmah DT","Brief Bioinform","2021","2020/11/17","PMC8293817","","10.1093/bib/bbaa286"
"33200787","Deep-joint-learning analysis model of single cell transcriptome and open chromatin accessibility data","Zuo C, Chen L.","Brief Bioinform. 2021 Jul 20;22(4):bbaa287. doi: 10.1093/bib/bbaa287.","Zuo C","Brief Bioinform","2021","2020/11/17","PMC8293818","","10.1093/bib/bbaa287"
"33197934","Deep learning in systems medicine","Wang H, Pujos-Guillot E, Comte B, de Miranda JL, Spiwok V, Chorbev I, Castiglione F, Tieri P, Watterson S, McAllister R, de Melo Malaquias T, Zanin M, Rai TS, Zheng H.","Brief Bioinform. 2021 Mar 22;22(2):1543-1559. doi: 10.1093/bib/bbaa237.","Wang H","Brief Bioinform","2021","2020/11/16","PMC8382976","","10.1093/bib/bbaa237"
"33179736","FunRes: resolving tissue-specific functional cell states based on a cell-cell communication network model","Jung S, Singh K, Del Sol A.","Brief Bioinform. 2021 Jul 20;22(4):bbaa283. doi: 10.1093/bib/bbaa283.","Jung S","Brief Bioinform","2021","2020/11/12","PMC8293827","","10.1093/bib/bbaa283"
"33152752","Negative Binomial mixed models estimated with the maximum likelihood method can be used for longitudinal RNAseq data","Tsonaka R, Spitali P.","Brief Bioinform. 2021 Jul 20;22(4):bbaa264. doi: 10.1093/bib/bbaa264.","Tsonaka R","Brief Bioinform","2021","2020/11/05","PMC8293834","","10.1093/bib/bbaa264"
"33142319","scAPAtrap: identification and quantification of alternative polyadenylation sites from single-cell RNA-seq data","Wu X, Liu T, Ye C, Ye W, Ji G.","Brief Bioinform. 2021 Jul 20;22(4):bbaa273. doi: 10.1093/bib/bbaa273.","Wu X","Brief Bioinform","2021","2020/11/03","","","10.1093/bib/bbaa273"
"33126245","Identification of pan-cancer Ras pathway activation with deep learning","Li X, Li S, Wang Y, Zhang S, Wong KC.","Brief Bioinform. 2021 Jul 20;22(4):bbaa258. doi: 10.1093/bib/bbaa258.","Li X","Brief Bioinform","2021","2020/10/30","","","10.1093/bib/bbaa258"
"33099604","Deep-Kcr: accurate detection of lysine crotonylation sites using deep learning method","Lv H, Dao FY, Guan ZX, Yang H, Li YW, Lin H.","Brief Bioinform. 2021 Jul 20;22(4):bbaa255. doi: 10.1093/bib/bbaa255.","Lv H","Brief Bioinform","2021","2020/10/25","","","10.1093/bib/bbaa255"
"33073843","Sequencing dropout-and-batch effect normalization for single-cell mRNA profiles: a survey and comparative analysis","Lan T, Hutvagner G, Lan Q, Liu T, Li J.","Brief Bioinform. 2021 Jul 20;22(4):bbaa248. doi: 10.1093/bib/bbaa248.","Lan T","Brief Bioinform","2021","2020/10/19","","","10.1093/bib/bbaa248"
"33063116","Robust Huber-LASSO for improved prediction of protein, metabolite and gene expression levels relying on individual genotype data","Deutelmoser H, Scherer D, Brenner H, Waldenberger M; INTERVAL study, Suhre K, Kastenmüller G, Lorenzo Bermejo J.","Brief Bioinform. 2021 Jul 20;22(4):bbaa230. doi: 10.1093/bib/bbaa230.","Deutelmoser H","Brief Bioinform","2021","2020/10/16","PMC8293825","","10.1093/bib/bbaa230"
"33048117","GuidingNet: revealing transcriptional cofactor and predicting binding for DNA methyltransferase by network regularization","Ren L, Gao C, Duren Z, Wang Y.","Brief Bioinform. 2021 Jul 20;22(4):bbaa245. doi: 10.1093/bib/bbaa245.","Ren L","Brief Bioinform","2021","2020/10/13","PMC8293812","","10.1093/bib/bbaa245"
"33003206","A spectral clustering with self-weighted multiple kernel learning method for single-cell RNA-seq data","Qi R, Wu J, Guo F, Xu L, Zou Q.","Brief Bioinform. 2021 Jul 20;22(4):bbaa216. doi: 10.1093/bib/bbaa216.","Qi R","Brief Bioinform","2021","2020/10/01","","","10.1093/bib/bbaa216"
"33003197","A computational toolset for rapid identification of SARS-CoV-2, other viruses and microorganisms from sequencing data","Chen S, He C, Li Y, Li Z, Melançon CE.","Brief Bioinform. 2021 Mar 22;22(2):924-935. doi: 10.1093/bib/bbaa231.","Chen S","Brief Bioinform","2021","2020/10/01","PMC7543257","","10.1093/bib/bbaa231"
"33003194","Adverse events associated with potential drugs for COVID-19: a case study from real-world data","Jing Y, Diao L, Han L.","Brief Bioinform. 2021 Mar 22;22(2):1232-1238. doi: 10.1093/bib/bbaa234.","Jing Y","Brief Bioinform","2021","2020/10/01","PMC7543289","","10.1093/bib/bbaa234"
"33003193","A review of digital cytometry methods: estimating the relative abundance of cell types in a bulk of cells","Le T, Aronow RA, Kirshtein A, Shahriyari L.","Brief Bioinform. 2021 Jul 20;22(4):bbaa219. doi: 10.1093/bib/bbaa219.","Le T","Brief Bioinform","2021","2020/10/01","PMC8293826","","10.1093/bib/bbaa219"
"32940334","Scanning window analysis of non-coding regions within normal-tumor whole-genome sequence samples","Torcivia JP, Mazumder R.","Brief Bioinform. 2021 May 20;22(3):bbaa203. doi: 10.1093/bib/bbaa203.","Torcivia JP","Brief Bioinform","2021","2020/09/17","PMC8138877","","10.1093/bib/bbaa203"
"32935831","Identification of the RNase-binding site of SARS-CoV-2 RNA for anchor primer-PCR detection of viral loading in 306 COVID-19 patients","Xu T, Wang J, Hu B, Zhang G, Zhou W, Zheng M, Shen B, Sun B, Zhang Y, Chen Y, Yu J, Liang M, Pan J, Chen C, Chen H, Jiang M, Xu L, Qu J, Chen JF.","Brief Bioinform. 2021 Mar 22;22(2):1215-1224. doi: 10.1093/bib/bbaa193.","Xu T","Brief Bioinform","2021","2020/09/16","PMC7543284","","10.1093/bib/bbaa193"
