PMID,Title,Authors,Citation,First Author,Journal/Book,Publication Year,Create Date,PMCID,NIHMS ID,DOI
"32337573","MPTherm: database for membrane protein thermodynamics for understanding folding and stability","Kulandaisamy A, Sakthivel R, Gromiha MM.","Brief Bioinform. 2021 Mar 22;22(2):2119-2125. doi: 10.1093/bib/bbaa064.","Kulandaisamy A","Brief Bioinform","2021","2020/04/28","","","10.1093/bib/bbaa064"
"32313939","Setting the basis of best practices and standards for curation and annotation of logical models in biology-highlights of the [BC]2 2019 CoLoMoTo/SysMod Workshop","Niarakis A, Kuiper M, Ostaszewski M, Malik Sheriff RS, Casals-Casas C, Thieffry D, Freeman TC, Thomas P, Touré V, Noël V, Stoll G, Saez-Rodriguez J, Naldi A, Oshurko E, Xenarios I, Soliman S, Chaouiya C, Helikar T, Calzone L.","Brief Bioinform. 2021 Mar 22;22(2):1848-1859. doi: 10.1093/bib/bbaa046.","Niarakis A","Brief Bioinform","2021","2020/04/22","PMC7986594","","10.1093/bib/bbaa046"
"32249310","GenoPheno: cataloging large-scale phenotypic and next-generation sequencing data within human datasets","Gutiérrez-Sacristán A, De Niz C, Kothari C, Kong SW, Mandl KD, Avillach P.","Brief Bioinform. 2021 Jan 18;22(1):55-65. doi: 10.1093/bib/bbaa033.","Gutiérrez-Sacristán A","Brief Bioinform","2021","2020/04/07","PMC7820848","","10.1093/bib/bbaa033"
"32249290","The mechanistic, diagnostic and therapeutic novel nucleic acids for hepatocellular carcinoma emerging in past score years","Zhang S, Zhou Y, Wang Y, Wang Z, Xiao Q, Zhang Y, Lou Y, Qiu Y, Zhu F.","Brief Bioinform. 2021 Mar 22;22(2):1860-1883. doi: 10.1093/bib/bbaa023.","Zhang S","Brief Bioinform","2021","2020/04/07","","","10.1093/bib/bbaa023"
"32232320","MeSHHeading2vec: a new method for representing MeSH headings as vectors based on graph embedding algorithm","Guo ZH, You ZH, Huang DS, Yi HC, Zheng K, Chen ZH, Wang YB.","Brief Bioinform. 2021 Mar 22;22(2):2085-2095. doi: 10.1093/bib/bbaa037.","Guo ZH","Brief Bioinform","2021","2020/04/02","PMC7986599","","10.1093/bib/bbaa037"
"32221552","Drug repositioning by prediction of drug's anatomical therapeutic chemical code via network-based inference approaches","Peng Y, Wang M, Xu Y, Wu Z, Wang J, Zhang C, Liu G, Li W, Li J, Tang Y.","Brief Bioinform. 2021 Mar 22;22(2):2058-2072. doi: 10.1093/bib/bbaa027.","Peng Y","Brief Bioinform","2021","2020/03/30","","","10.1093/bib/bbaa027"
"32219306","Homoeologous gene expression and co-expression network analyses and evolutionary inference in allopolyploids","Hu G, Grover CE, Arick MA, Liu M, Peterson DG, Wendel JF.","Brief Bioinform. 2021 Mar 22;22(2):1819-1835. doi: 10.1093/bib/bbaa035.","Hu G","Brief Bioinform","2021","2020/03/29","PMC7986634","","10.1093/bib/bbaa035"
"32186712","Adaptive multi-source multi-view latent feature learning for inferring potential disease-associated miRNAs","Xiao Q, Zhang N, Luo J, Dai J, Tang X.","Brief Bioinform. 2021 Mar 22;22(2):2043-2057. doi: 10.1093/bib/bbaa028.","Xiao Q","Brief Bioinform","2021","2020/03/19","","","10.1093/bib/bbaa028"
"32119069","An absolute human stemness index associated with oncogenic dedifferentiation","Zheng H, Song K, Fu Y, You T, Yang J, Guo W, Wang K, Jin L, Gu Y, Qi L, Zhao W.","Brief Bioinform. 2021 Mar 22;22(2):2151-2160. doi: 10.1093/bib/bbz174.","Zheng H","Brief Bioinform","2021","2020/03/03","","","10.1093/bib/bbz174"
"32083642","Closing the gap between formats for storing layout information in systems biology","Hoksza D, Gawron P, Ostaszewski M, Hasenauer J, Schneider R.","Brief Bioinform. 2021 Jan 18;22(1):608. doi: 10.1093/bib/bbaa030.","Hoksza D","Brief Bioinform","2021","2020/02/22","PMC7820845","","10.1093/bib/bbaa030"
"32065227","Biological applications of knowledge graph embedding models","Mohamed SK, Nounu A, Nováček V.","Brief Bioinform. 2021 Mar 22;22(2):1679-1693. doi: 10.1093/bib/bbaa012.","Mohamed SK","Brief Bioinform","2021","2020/02/18","","","10.1093/bib/bbaa012"
"32047891","Network analyses in microbiome based on high-throughput multi-omics data","Liu Z, Ma A, Mathé E, Merling M, Ma Q, Liu B.","Brief Bioinform. 2021 Mar 22;22(2):1639-1655. doi: 10.1093/bib/bbaa005.","Liu Z","Brief Bioinform","2021","2020/02/13","PMC7986608","","10.1093/bib/bbaa005"
"32047889","Mass spectrometry-based protein identification in proteomics-a review","Noor Z, Ahn SB, Baker MS, Ranganathan S, Mohamedali A.","Brief Bioinform. 2021 Mar 22;22(2):1620-1638. doi: 10.1093/bib/bbz163.","Noor Z","Brief Bioinform","2021","2020/02/13","","","10.1093/bib/bbz163"
"32043137","EP3: an ensemble predictor that accurately identifies type III secreted effectors","Li J, Wei L, Guo F, Zou Q.","Brief Bioinform. 2021 Mar 22;22(2):1918-1928. doi: 10.1093/bib/bbaa008.","Li J","Brief Bioinform","2021","2020/02/12","","","10.1093/bib/bbaa008"
"32031572","High-dimensional variable selection for ordinal outcomes with error control","Fu H, Archer KJ.","Brief Bioinform. 2021 Jan 18;22(1):334-345. doi: 10.1093/bib/bbaa007.","Fu H","Brief Bioinform","2021","2020/02/08","PMC7820886","","10.1093/bib/bbaa007"
"32008042","Domain-specific introduction to machine learning terminology, pitfalls and opportunities in CRISPR-based gene editing","O'Brien AR, Burgio G, Bauer DC.","Brief Bioinform. 2021 Jan 18;22(1):308-314. doi: 10.1093/bib/bbz145.","O'Brien AR","Brief Bioinform","2021","2020/02/03","PMC7820861","","10.1093/bib/bbz145"
"31996905","Erratum to: LARMD: integration of bioinformatic resources to profile ligand-driven protein dynamics with a case on the activation of estrogen receptor","Yang JF, Wang F, Chen YZ, Hao GF, Yang GF.","Brief Bioinform. 2021 Jan 18;22(1):605. doi: 10.1093/bib/bbaa010.","Yang JF","Brief Bioinform","2021","2020/01/31","","","10.1093/bib/bbaa010"
"31960888","Erratum to: Molecular dynamics simulations for genetic interpretation in protein coding regions: where we are, where to go and when","Galano-Frutos JJ, García-Cebollada H, Sancho J.","Brief Bioinform. 2021 Jan 18;22(1):604. doi: 10.1093/bib/bbz172.","Galano-Frutos JJ","Brief Bioinform","2021","2020/01/22","PMC7820851","","10.1093/bib/bbz172"
"31885042","On the critical review of five machine learning-based algorithms for predicting protein stability changes upon mutation","Savojardo C, Martelli PL, Casadio R, Fariselli P.","Brief Bioinform. 2021 Jan 18;22(1):601-603. doi: 10.1093/bib/bbz168.","Savojardo C","Brief Bioinform","2021","2019/12/31","","","10.1093/bib/bbz168"
"31885040","Small noncoding RNA discovery and profiling with sRNAtools based on high-throughput sequencing","Liu Q, Ding C, Lang X, Guo G, Chen J, Su X.","Brief Bioinform. 2021 Jan 18;22(1):463-473. doi: 10.1093/bib/bbz151.","Liu Q","Brief Bioinform","2021","2019/12/31","PMC7820841","","10.1093/bib/bbz151"
"31885036","Drug-target prediction utilizing heterogeneous bio-linked network embeddings","Zong N, Wong RSN, Yu Y, Wen A, Huang M, Li N.","Brief Bioinform. 2021 Jan 18;22(1):568-580. doi: 10.1093/bib/bbz147.","Zong N","Brief Bioinform","2021","2019/12/31","","","10.1093/bib/bbz147"
"31838491","Improving drug response prediction by integrating multiple data sources: matrix factorization, kernel and network-based approaches","Güvenç Paltun B, Mamitsuka H, Kaski S.","Brief Bioinform. 2021 Jan 18;22(1):346-359. doi: 10.1093/bib/bbz153.","Güvenç Paltun B","Brief Bioinform","2021","2019/12/16","PMC7820853","","10.1093/bib/bbz153"
"31813948","Current RNA-seq methodology reporting limits reproducibility","Simoneau J, Dumontier S, Gosselin R, Scott MS.","Brief Bioinform. 2021 Jan 18;22(1):140-145. doi: 10.1093/bib/bbz124.","Simoneau J","Brief Bioinform","2021","2019/12/10","PMC7820846","","10.1093/bib/bbz124"
"34891158","A tale of solving two computational challenges in protein science: neoantigen prediction and protein structure prediction","Tran NH, Xu J, Li M.","Brief Bioinform. 2021 Dec 9:bbab493. doi: 10.1093/bib/bbab493. Online ahead of print.","Tran NH","Brief Bioinform","2021","2021/12/10","","","10.1093/bib/bbab493"
"34882198","Distant metastasis identification based on optimized graph representation of gene interaction patterns","Su R, Zhu Y, Zou Q, Wei L.","Brief Bioinform. 2021 Dec 9:bbab468. doi: 10.1093/bib/bbab468. Online ahead of print.","Su R","Brief Bioinform","2021","2021/12/09","","","10.1093/bib/bbab468"
"34864885","Network analytics for drug repurposing in COVID-19","Siminea N, Popescu V, Sanchez Martin JA, Florea D, Gavril G, Gheorghe AM, Iţcuş C, Kanhaiya K, Pacioglu O, Popa IL, Trandafir R, Tusa MI, Sidoroff M, Păun M, Czeizler E, Păun A, Petre I.","Brief Bioinform. 2021 Dec 2:bbab490. doi: 10.1093/bib/bbab490. Online ahead of print.","Siminea N","Brief Bioinform","2021","2021/12/05","PMC8690228","","10.1093/bib/bbab490"
"34849572","iProbiotics: a machine learning platform for rapid identification of probiotic properties from whole-genome primary sequences","Sun Y, Li H, Zheng L, Li J, Hong Y, Liang P, Kwok LY, Zuo Y, Zhang W, Zhang H.","Brief Bioinform. 2021 Nov 27:bbab477. doi: 10.1093/bib/bbab477. Online ahead of print.","Sun Y","Brief Bioinform","2021","2021/12/01","","","10.1093/bib/bbab477"
"34791021","Machine learning meets omics: applications and perspectives","Li R, Li L, Xu Y, Yang J.","Brief Bioinform. 2021 Nov 13:bbab460. doi: 10.1093/bib/bbab460. Online ahead of print.","Li R","Brief Bioinform","2021","2021/11/18","","","10.1093/bib/bbab460"
"34791014","A roadmap for multi-omics data integration using deep learning","Kang M, Ko E, Mersha TB.","Brief Bioinform. 2021 Nov 12:bbab454. doi: 10.1093/bib/bbab454. Online ahead of print.","Kang M","Brief Bioinform","2021","2021/11/18","","","10.1093/bib/bbab454"
"34718406","MZINBVA: variational approximation for multilevel zero-inflated negative-binomial models for association analysis in microbiome surveys","Liu T, Xu P, Du Y, Lu H, Zhao H, Wang T.","Brief Bioinform. 2021 Oct 26:bbab443. doi: 10.1093/bib/bbab443. Online ahead of print.","Liu T","Brief Bioinform","2021","2021/10/31","","","10.1093/bib/bbab443"
"34387328","Corrigendum to: Genetic mechanisms of COVID-19 and its association with smoking and alcohol consumption","Rao S, Baranova A, Cao H, Chen J, Zhang X, Zhang F.","Brief Bioinform. 2021 Nov 5;22(6):bbab357. doi: 10.1093/bib/bbab357.","Rao S","Brief Bioinform","2021","2021/08/13","PMC8385990","","10.1093/bib/bbab357"
"34368830","Genome-wide hierarchical mixed model association analysis","Hao Z, Gao J, Song Y, Yang R, Liu D.","Brief Bioinform. 2021 Nov 5;22(6):bbab306. doi: 10.1093/bib/bbab306.","Hao Z","Brief Bioinform","2021","2021/08/09","PMC8575042","","10.1093/bib/bbab306"
"34297793","Deep learning-based real-time detection of novel pathogens during sequencing","Bartoszewicz JM, Genske U, Renard BY.","Brief Bioinform. 2021 Nov 5;22(6):bbab269. doi: 10.1093/bib/bbab269.","Bartoszewicz JM","Brief Bioinform","2021","2021/07/23","","","10.1093/bib/bbab269"
"34219140","Identifying complex motifs in massive omics data with a variable-convolutional layer in deep neural network","Li JY, Jin S, Tu XM, Ding Y, Gao G.","Brief Bioinform. 2021 Nov 5;22(6):bbab233. doi: 10.1093/bib/bbab233.","Li JY","Brief Bioinform","2021","2021/07/05","","","10.1093/bib/bbab233"
"34213525","A novel graph attention model for predicting frequencies of drug-side effects from multi-view data","Zhao H, Zheng K, Li Y, Wang J.","Brief Bioinform. 2021 Nov 5;22(6):bbab239. doi: 10.1093/bib/bbab239.","Zhao H","Brief Bioinform","2021","2021/07/02","","","10.1093/bib/bbab239"
"34111889","Single-cell multi-omics sequencing: application trends, COVID-19, data analysis issues and prospects","Huo L, Jiao Li J, Chen L, Yu Z, Hutvagner G, Li J.","Brief Bioinform. 2021 Nov 5;22(6):bbab229. doi: 10.1093/bib/bbab229.","Huo L","Brief Bioinform","2021","2021/06/10","PMC8344433","","10.1093/bib/bbab229"
"33834198","DisBalance: a platform to automatically build balance-based disease prediction models and discover microbial biomarkers from microbiome data","Yang F, Zou Q.","Brief Bioinform. 2021 Sep 2;22(5):bbab094. doi: 10.1093/bib/bbab094.","Yang F","Brief Bioinform","2021","2021/04/09","","","10.1093/bib/bbab094"
"33822848","Comprehensive characterization of alternative splicing in renal cell carcinoma","Zhang Y, Wu X, Li J, Sun K, Li H, Yan L, Duan C, Liu H, Chen K, Ye Z, Liu M, Xu H.","Brief Bioinform. 2021 Sep 2;22(5):bbab084. doi: 10.1093/bib/bbab084.","Zhang Y","Brief Bioinform","2021","2021/04/06","","","10.1093/bib/bbab084"
"33821961","MMRFBiolinks: an R-package for integrating and analyzing MMRF-CoMMpass data","Settino M, Cannataro M.","Brief Bioinform. 2021 Sep 2;22(5):bbab050. doi: 10.1093/bib/bbab050.","Settino M","Brief Bioinform","2021","2021/04/06","","","10.1093/bib/bbab050"
"33415328","Classification and gene selection of triple-negative breast cancer subtype embedding gene connectivity matrix in deep neural network","Liu J, Su R, Zhang J, Wei L.","Brief Bioinform. 2021 Sep 2;22(5):bbaa395. doi: 10.1093/bib/bbaa395.","Liu J","Brief Bioinform","2021","2021/01/08","","","10.1093/bib/bbaa395"
"33276376","Recent advances in network-based methods for disease gene prediction","Ata SK, Wu M, Fang Y, Ou-Yang L, Kwoh CK, Li XL.","Brief Bioinform. 2021 Jul 20;22(4):bbaa303. doi: 10.1093/bib/bbaa303.","Ata SK","Brief Bioinform","2021","2020/12/04","","","10.1093/bib/bbaa303"
"32591816","ExoBCD: a comprehensive database for exosomal biomarker discovery in breast cancer","Wang X, Chai Z, Pan G, Hao Y, Li B, Ye T, Li Y, Long F, Xia L, Liu M.","Brief Bioinform. 2021 May 20;22(3):bbaa088. doi: 10.1093/bib/bbaa088.","Wang X","Brief Bioinform","2021","2020/06/28","","","10.1093/bib/bbaa088"
"33517359","Prediction of RNA-binding protein and alternative splicing event associations during epithelial-mesenchymal transition based on inductive matrix completion","Qiu Y, Ching WK, Zou Q.","Brief Bioinform. 2021 Sep 2;22(5):bbaa440. doi: 10.1093/bib/bbaa440.","Qiu Y","Brief Bioinform","2021","2021/01/31","","","10.1093/bib/bbaa440"
"33515000","MITGARD: an automated pipeline for mitochondrial genome assembly in eukaryotic species using RNA-seq data","Nachtigall PG, Grazziotin FG, Junqueira-de-Azevedo ILM.","Brief Bioinform. 2021 Sep 2;22(5):bbaa429. doi: 10.1093/bib/bbaa429.","Nachtigall PG","Brief Bioinform","2021","2021/01/30","","","10.1093/bib/bbaa429"
"33461215","Ligand-based approach for predicting drug targets and for virtual screening against COVID-19","Yang Y, Zhu Z, Wang X, Zhang X, Mu K, Shi Y, Peng C, Xu Z, Zhu W.","Brief Bioinform. 2021 Mar 22;22(2):1053-1064. doi: 10.1093/bib/bbaa422.","Yang Y","Brief Bioinform","2021","2021/01/18","PMC7929377","","10.1093/bib/bbaa422"
"33454737","Anthem: a user customised tool for fast and accurate prediction of binding between peptides and HLA class I molecules","Mei S, Li F, Xiang D, Ayala R, Faridi P, Webb GI, Illing PT, Rossjohn J, Akutsu T, Croft NP, Purcell AW, Song J.","Brief Bioinform. 2021 Sep 2;22(5):bbaa415. doi: 10.1093/bib/bbaa415.","Mei S","Brief Bioinform","2021","2021/01/17","","","10.1093/bib/bbaa415"
"33454736","Identification of haploinsufficient genes from epigenomic data using deep forest","Yang Y, Li S, Wang Y, Ma Z, Wong KC, Li X.","Brief Bioinform. 2021 Sep 2;22(5):bbaa393. doi: 10.1093/bib/bbaa393.","Yang Y","Brief Bioinform","2021","2021/01/17","","","10.1093/bib/bbaa393"
"33454728","Health informatics and EHR to support clinical research in the COVID-19 pandemic: an overview","Dagliati A, Malovini A, Tibollo V, Bellazzi R.","Brief Bioinform. 2021 Mar 22;22(2):812-822. doi: 10.1093/bib/bbaa418.","Dagliati A","Brief Bioinform","2021","2021/01/17","PMC7929411","","10.1093/bib/bbaa418"
"33443536","Exploring associations of non-coding RNAs in human diseases via three-matrix factorization with hypergraph-regular terms on center kernel alignment","Wang H, Tang J, Ding Y, Guo F.","Brief Bioinform. 2021 Sep 2;22(5):bbaa409. doi: 10.1093/bib/bbaa409.","Wang H","Brief Bioinform","2021","2021/01/14","","","10.1093/bib/bbaa409"
"33432324","Deciphering the genetic code of DNA methylation","Wang M, Ngo V, Wang W.","Brief Bioinform. 2021 Sep 2;22(5):bbaa424. doi: 10.1093/bib/bbaa424.","Wang M","Brief Bioinform","2021","2021/01/12","PMC8425266","","10.1093/bib/bbaa424"
"33423067","Transcriptome analysis of cepharanthine against a SARS-CoV-2-related coronavirus","Li S, Liu W, Chen Y, Wang L, An W, An X, Song L, Tong Y, Fan H, Lu C.","Brief Bioinform. 2021 Mar 22;22(2):1378-1386. doi: 10.1093/bib/bbaa387.","Li S","Brief Bioinform","2021","2021/01/10","PMC7929461","","10.1093/bib/bbaa387"
"33416890","Bioinformatics resources for SARS-CoV-2 discovery and surveillance","Hu T, Li J, Zhou H, Li C, Holmes EC, Shi W.","Brief Bioinform. 2021 Mar 22;22(2):631-641. doi: 10.1093/bib/bbaa386.","Hu T","Brief Bioinform","2021","2021/01/08","PMC7929396","","10.1093/bib/bbaa386"
"33416848","SARS-CoV-2 3D database: understanding the coronavirus proteome and evaluating possible drug targets","Alsulami AF, Thomas SE, Jamasb AR, Beaudoin CA, Moghul I, Bannerman B, Copoiu L, Vedithi SC, Torres P, Blundell TL.","Brief Bioinform. 2021 Mar 22;22(2):769-780. doi: 10.1093/bib/bbaa404.","Alsulami AF","Brief Bioinform","2021","2021/01/08","PMC7929435","","10.1093/bib/bbaa404"
"33406530","Towards deep phenotyping pregnancy: a systematic review on artificial intelligence and machine learning methods to improve pregnancy outcomes","Davidson L, Boland MR.","Brief Bioinform. 2021 Sep 2;22(5):bbaa369. doi: 10.1093/bib/bbaa369.","Davidson L","Brief Bioinform","2021","2021/01/06","PMC8424395","","10.1093/bib/bbaa369"
"33406221","iCysMod: an integrative database for protein cysteine modifications in eukaryotes","Wang P, Zhang Q, Li S, Cheng B, Xue H, Wei Z, Shao T, Liu ZX, Cheng H, Wang Z.","Brief Bioinform. 2021 Sep 2;22(5):bbaa400. doi: 10.1093/bib/bbaa400.","Wang P","Brief Bioinform","2021","2021/01/06","","","10.1093/bib/bbaa400"
"33406218","A comprehensive drug repurposing study for COVID19 treatment: novel putative dihydroorotate dehydrogenase inhibitors show association to serotonin-dopamine receptors","Berber B, Doluca O.","Brief Bioinform. 2021 Mar 22;22(2):1023-1037. doi: 10.1093/bib/bbaa379.","Berber B","Brief Bioinform","2021","2021/01/06","PMC7929379","","10.1093/bib/bbaa379"
"33388743","SubLocEP: a novel ensemble predictor of subcellular localization of eukaryotic mRNA based on machine learning","Li J, Zhang L, He S, Guo F, Zou Q.","Brief Bioinform. 2021 Sep 2;22(5):bbaa401. doi: 10.1093/bib/bbaa401.","Li J","Brief Bioinform","2021","2021/01/03","","","10.1093/bib/bbaa401"
"33386025","Identifying the natural polyphenol catechin as a multi-targeted agent against SARS-CoV-2 for the plausible therapy of COVID-19: an integrated computational approach","Mishra CB, Pandey P, Sharma RD, Malik MZ, Mongre RK, Lynn AM, Prasad R, Jeon R, Prakash A.","Brief Bioinform. 2021 Mar 22;22(2):1346-1360. doi: 10.1093/bib/bbaa378.","Mishra CB","Brief Bioinform","2021","2021/01/01","PMC7799228","","10.1093/bib/bbaa378"
"33378765","The status of causality in biological databases: data resources and data retrieval possibilities to support logical modeling","Touré V, Flobak Å, Niarakis A, Vercruysse S, Kuiper M.","Brief Bioinform. 2021 Jul 20;22(4):bbaa390. doi: 10.1093/bib/bbaa390.","Touré V","Brief Bioinform","2021","2020/12/30","PMC8294520","","10.1093/bib/bbaa390"
"33372958","Deep learning approaches for neural decoding across architectures and recording modalities","Livezey JA, Glaser JI.","Brief Bioinform. 2021 Mar 22;22(2):1577-1591. doi: 10.1093/bib/bbaa355.","Livezey JA","Brief Bioinform","2021","2020/12/29","","","10.1093/bib/bbaa355"
"33348357","Deep inverse reinforcement learning for structural evolution of small molecules","Agyemang B, Wu WP, Addo D, Kpiebaareh MY, Nanor E, Roland Haruna C.","Brief Bioinform. 2021 Jul 20;22(4):bbaa364. doi: 10.1093/bib/bbaa364.","Agyemang B","Brief Bioinform","2021","2020/12/21","","","10.1093/bib/bbaa364"
"33346826","Current challenges for unseen-epitope TCR interaction prediction and a new perspective derived from image classification","Moris P, De Pauw J, Postovskaya A, Gielis S, De Neuter N, Bittremieux W, Ogunjimi B, Laukens K, Meysman P.","Brief Bioinform. 2021 Jul 20;22(4):bbaa318. doi: 10.1093/bib/bbaa318.","Moris P","Brief Bioinform","2021","2020/12/21","PMC8294552","","10.1093/bib/bbaa318"
"33333559","Gene expression profiling of SARS-CoV-2 infections reveal distinct primary lung cell and systemic immune infection responses that identify pathways relevant in COVID-19 disease","Moni MA, Quinn JMW, Sinmaz N, Summers MA.","Brief Bioinform. 2021 Mar 22;22(2):1324-1337. doi: 10.1093/bib/bbaa376.","Moni MA","Brief Bioinform","2021","2020/12/17","PMC7799202","","10.1093/bib/bbaa376"
"33333550","Computational methods for annotation of plant regulatory non-coding RNAs using RNA-seq","Vivek AT, Kumar S.","Brief Bioinform. 2021 Jul 20;22(4):bbaa322. doi: 10.1093/bib/bbaa322.","Vivek AT","Brief Bioinform","2021","2020/12/17","","","10.1093/bib/bbaa322"
"33320930","CyanoPATH: a knowledgebase of genome-scale functional repertoire for toxic cyanobacterial blooms","Du W, Li G, Ho N, Jenkins L, Hockaday D, Tan J, Cao H.","Brief Bioinform. 2021 Jul 20;22(4):bbaa375. doi: 10.1093/bib/bbaa375.","Du W","Brief Bioinform","2021","2020/12/15","","","10.1093/bib/bbaa375"
"33316032","Dppa2/4 as a trigger of signaling pathways to promote zygote genome activation by binding to CG-rich region","Li H, Long C, Xiang J, Liang P, Li X, Zuo Y.","Brief Bioinform. 2021 Jul 20;22(4):bbaa342. doi: 10.1093/bib/bbaa342.","Li H","Brief Bioinform","2021","2020/12/14","","","10.1093/bib/bbaa342"
"33313775","Prediction of protein-carbohydrate complex binding affinity using structural features","Siva Shanmugam NR, Jino Blessy J, Veluraja K, Gromiha MM.","Brief Bioinform. 2021 Jul 20;22(4):bbaa319. doi: 10.1093/bib/bbaa319.","Siva Shanmugam NR","Brief Bioinform","2021","2020/12/14","","","10.1093/bib/bbaa319"
"33313674","ColorCells: a database of expression, classification and functions of lncRNAs in single cells","Zheng LL, Xiong JH, Zheng WJ, Wang JH, Huang ZL, Chen ZR, Sun XY, Zheng YM, Zhou KR, Li B, Liu S, Qu LH, Yang JH.","Brief Bioinform. 2021 Jul 20;22(4):bbaa325. doi: 10.1093/bib/bbaa325.","Zheng LL","Brief Bioinform","2021","2020/12/14","","","10.1093/bib/bbaa325"
"33285566","Key residues influencing binding affinities of 2019-nCoV with ACE2 in different species","Fang S, Zheng R, Lei C, Wang J, Zheng R, Li M.","Brief Bioinform. 2021 Mar 22;22(2):963-975. doi: 10.1093/bib/bbaa329.","Fang S","Brief Bioinform","2021","2020/12/07","PMC7799256","","10.1093/bib/bbaa329"
"33279983","DeepYY1: a deep learning approach to identify YY1-mediated chromatin loops","Dao FY, Lv H, Zhang D, Zhang ZM, Liu L, Lin H.","Brief Bioinform. 2021 Jul 20;22(4):bbaa356. doi: 10.1093/bib/bbaa356.","Dao FY","Brief Bioinform","2021","2020/12/06","","","10.1093/bib/bbaa356"
"33257942","A study of leaf-senescence genes in rice based on a combination of genomics, proteomics and bioinformatics","Xiong E, Li Z, Zhang C, Zhang J, Liu Y, Peng T, Chen Z, Zhao Q.","Brief Bioinform. 2021 Jul 20;22(4):bbaa305. doi: 10.1093/bib/bbaa305.","Xiong E","Brief Bioinform","2021","2020/12/01","","","10.1093/bib/bbaa305"
"33253353","Drug repurposing for COVID-19: could vitamin C combined with glycyrrhizic acid be at play by the findings of Li et al.'s database-based network pharmacology analysis?","Huang YX, Wang WX, Tang YP, Yue SJ.","Brief Bioinform. 2021 Mar 22;22(2):1508-1510. doi: 10.1093/bib/bbaa330.","Huang YX","Brief Bioinform","2021","2020/11/30","PMC7799235","","10.1093/bib/bbaa330"
"33201237","AlgPred 2.0: an improved method for predicting allergenic proteins and mapping of IgE epitopes","Sharma N, Patiyal S, Dhall A, Pande A, Arora C, Raghava GPS.","Brief Bioinform. 2021 Jul 20;22(4):bbaa294. doi: 10.1093/bib/bbaa294.","Sharma N","Brief Bioinform","2021","2020/11/17","","","10.1093/bib/bbaa294"
"33147626","CellTalkDB: a manually curated database of ligand-receptor interactions in humans and mice","Shao X, Liao J, Li C, Lu X, Cheng J, Fan X.","Brief Bioinform. 2021 Jul 20;22(4):bbaa269. doi: 10.1093/bib/bbaa269.","Shao X","Brief Bioinform","2021","2020/11/04","","","10.1093/bib/bbaa269"
"33147620","TrimNet: learning molecular representation from triplet messages for biomedicine","Li P, Li Y, Hsieh CY, Zhang S, Liu X, Liu H, Song S, Yao X.","Brief Bioinform. 2021 Jul 20;22(4):bbaa266. doi: 10.1093/bib/bbaa266.","Li P","Brief Bioinform","2021","2020/11/04","","","10.1093/bib/bbaa266"
"33126247","LDBlockShow: a fast and convenient tool for visualizing linkage disequilibrium and haplotype blocks based on variant call format files","Dong SS, He WM, Ji JJ, Zhang C, Guo Y, Yang TL.","Brief Bioinform. 2021 Jul 20;22(4):bbaa227. doi: 10.1093/bib/bbaa227.","Dong SS","Brief Bioinform","2021","2020/10/30","","","10.1093/bib/bbaa227"
"33096548","Predicting enhancer-promoter interactions by deep learning and matching heuristic","Min X, Ye C, Liu X, Zeng X.","Brief Bioinform. 2021 Jul 20;22(4):bbaa254. doi: 10.1093/bib/bbaa254.","Min X","Brief Bioinform","2021","2020/10/23","","","10.1093/bib/bbaa254"
"33094325","Prediction of driver variants in the cancer genome via machine learning methodologies","Rogers MF, Gaunt TR, Campbell C.","Brief Bioinform. 2021 Jul 20;22(4):bbaa250. doi: 10.1093/bib/bbaa250.","Rogers MF","Brief Bioinform","2021","2020/10/23","PMC8293831","","10.1093/bib/bbaa250"
"33094321","VPTMdb: a viral posttranslational modification database","Xiang Y, Zou Q, Zhao L.","Brief Bioinform. 2021 Jul 20;22(4):bbaa251. doi: 10.1093/bib/bbaa251.","Xiang Y","Brief Bioinform","2021","2020/10/23","","","10.1093/bib/bbaa251"
"33094318","Prognostic outcome prediction by semi-supervised least squares classification","Shi M, Sheng Z, Tang H.","Brief Bioinform. 2021 Jul 20;22(4):bbaa249. doi: 10.1093/bib/bbaa249.","Shi M","Brief Bioinform","2021","2020/10/23","","","10.1093/bib/bbaa249"
